Book Name,Author,Publisher,Date Published,Genre,Availability,Return Date,Audience,ISBN,Library Section,Rating,Reviews,Language,Synopsis,Number of Pages,Parent Genre,Complexity,On Demand
Me think meet available.,Steven Turner,"Gibson, Walker and Smith",2022-01-12,Children's,4,Available,Children,978-1-136-85602-0,Special Collection,1.5,933,Chinese,"A humorous collection of anecdotes and stories that entertain and amuse, providing a lighthearted escape from everyday life.",369,Commerce,Hard,Yes
Rule central stuff official.,Jessica Davis,Schaefer-Bennett,2019-06-20,Romance,6,Available,Children,978-1-57311-722-7,General,1.3,886,English,"A charming children's book that captivates young readers with its engaging story, colorful illustrations, and valuable life lessons.",780,Science,Medium,Yes
Whatever left of.,Grant Wilson,Brooks PLC,2014-11-08,Fiction,10,Available,Teens,978-0-423-20796-5,Special Collection,1.2,151,Japanese,"A humorous collection of anecdotes and stories that entertain and amuse, providing a lighthearted escape from everyday life.",200,Art,Medium,No
Player skill join four.,Elizabeth Hughes,Conrad-Price,2018-12-14,Fantasy,0,2024-07-09,Young Adults,978-0-8304-4739-8,Reference,4.7,914,Spanish,"An engaging analysis of contemporary social issues, encouraging readers to reflect on and challenge their perspectives.",693,Commerce,Hard,No
Room pretty to.,David Williams,Jones PLC,2022-07-21,Mystery,4,2024-07-03,Teens,978-1-4399-5322-8,Special Collection,1.5,962,Chinese,"A gripping tale of adventure and self-discovery, following the journey of a young protagonist as they navigate through unexpected challenges and triumphs.",490,Science,Medium,Yes
Physical measure someone.,Katherine Raymond,Stewart Group,2017-04-17,Non-Fiction,8,Available,Teens,978-0-8383-3108-8,Special Collection,1.3,551,English,"An engaging analysis of contemporary social issues, encouraging readers to reflect on and challenge their perspectives.",780,Commerce,Hard,Yes
Upon discussion.,Christopher Turner,"Williamson, Jones and Dominguez",2023-06-14,Mystery,6,2024-07-01,Teens,978-0-560-36882-6,Reserve,1.4,499,Chinese,"A humorous collection of anecdotes and stories that entertain and amuse, providing a lighthearted escape from everyday life.",827,Art,Medium,Yes
Discussion receive medical.,Darlene Acosta,"Mclaughlin, Deleon and Oliver",2016-04-22,Thriller,0,Available,Children,978-1-303-03923-2,General,3.9,558,Spanish,"An inspiring story of resilience and determination, showcasing how the protagonist overcomes adversity to achieve their dreams.",486,Art,Medium,No
Amount.,David Wood,Romero Group,2020-11-27,Children's,10,Available,Adults,978-1-900484-91-6,Reserve,1.5,865,Spanish,"A captivating drama that delves into the complexities of family dynamics, loyalty, and the pursuit of personal identity.",1000,Commerce,Hard,Yes
Later.,Christine Stephens,Nash LLC,2015-06-27,Science Fiction,6,Available,Adults,978-0-203-74227-3,General,2.5,85,German,"A charming children's book that captivates young readers with its engaging story, colorful illustrations, and valuable life lessons.",225,Art,Easy,No
Green similar.,Todd Garcia,Williamson-Weaver,2022-02-03,Self-Help,4,Available,Teens,978-0-599-22867-2,General,4.8,262,Chinese,"A detailed guide to understanding the intricacies of a specific field, offering expert insights and practical knowledge.",557,Commerce,Hard,Yes
By spend.,Beth Anthony,Gonzalez Ltd,2018-07-01,Romance,6,Available,Young Adults,978-1-08-433814-2,Special Collection,3.5,217,Japanese,"A thought-provoking biography of a remarkable individual, highlighting their achievements, struggles, and contributions to society.",188,Science,Medium,Yes
Raise same year.,Christina Moses,Miles-Higgins,2021-07-13,Non-Fiction,3,2024-07-09,Young Adults,978-1-5047-3080-8,Special Collection,1.1,167,Japanese,"An intriguing exploration of the natural world, filled with stunning visuals and fascinating facts about various species.",114,Art,Easy,No
Manager accept.,Mark Doyle,Kemp PLC,2023-04-11,Romance,5,Available,Teens,978-1-361-46712-1,General,1.4,121,Japanese,"A charming children's book that captivates young readers with its engaging story, colorful illustrations, and valuable life lessons.",375,Science,Medium,No
Agreement few receive foot.,Robert Berry,Fleming-Moore,2023-03-30,Fantasy,2,Available,Children,978-1-217-06369-9,Reference,3.4,274,French,"An intriguing exploration of the natural world, filled with stunning visuals and fascinating facts about various species.",910,Science,Medium,Yes
Situation plant first.,Anthony Allen,Johnson-Johnson,2024-03-15,Thriller,2,Available,Teens,978-1-4173-9697-9,General,3.4,333,Spanish,"A thrilling mystery that keeps readers on the edge of their seats, unraveling secrets and twists with every turn of the page.",926,Art,Hard,Yes
Call analysis.,Candace Jones,Jennings LLC,2019-08-05,Self-Help,1,Available,Young Adults,978-1-5441-8160-8,General,3.2,562,Japanese,"An inspiring story of resilience and determination, showcasing how the protagonist overcomes adversity to achieve their dreams.",266,Science,Medium,No
Hundred.,Robert Fitzpatrick,Young and Sons,2015-04-03,Mystery,9,Available,Young Adults,978-1-01-070004-3,Special Collection,4.2,16,Japanese,"A charming children's book that captivates young readers with its engaging story, colorful illustrations, and valuable life lessons.",466,Science,Easy,Yes
Clearly sea present.,Paul Navarro,"Conway, Johnson and Guzman",2024-01-23,Fiction,5,Available,Teens,978-1-233-01055-4,General,1.7,348,Spanish,"A gripping tale of adventure and self-discovery, following the journey of a young protagonist as they navigate through unexpected challenges and triumphs.",609,Art,Hard,Yes
Girl offer.,Terri Johnston,"Mitchell, Kaufman and Bradford",2015-09-07,Non-Fiction,2,Available,Children,978-0-398-53720-3,Special Collection,3.3,519,French,"An insightful exploration of human emotions and relationships, delving deep into the complexities of love, loss, and personal growth.",341,Art,Hard,Yes
Thus quickly accept.,Roger Swanson,Hunt Ltd,2022-10-13,Mystery,0,Available,Seniors,978-0-03-118350-7,Reference,2.1,964,Chinese,"A captivating science fiction story set in a futuristic world, exploring the impact of technology on society and human interactions.",317,Art,Hard,Yes
Partner require later.,Brian Phillips,Jackson Inc,2023-07-21,Fiction,6,2024-07-17,Adults,978-1-57325-154-9,Special Collection,2.2,0,Chinese,"A gripping tale of adventure and self-discovery, following the journey of a young protagonist as they navigate through unexpected challenges and triumphs.",399,Commerce,Hard,Yes
Sport however son.,Ryan Lutz,"Greer, Johnson and Smith",2020-10-10,Fiction,9,Available,Teens,978-1-66526-836-3,Reserve,3.4,157,German,"A captivating science fiction story set in a futuristic world, exploring the impact of technology on society and human interactions.",460,Science,Easy,Yes
Fund simply almost.,Alex Shepard,"Harris, Rodriguez and Dodson",2015-02-18,Mystery,6,Available,Young Adults,978-1-340-25132-1,Special Collection,4.4,368,French,"An enchanting fantasy novel filled with magic, mythical creatures, and epic quests that transport readers to a fantastical realm.",297,Science,Easy,Yes
Character tree.,James Jordan,"Callahan, Wallace and Wolfe",2014-12-02,Self-Help,7,2024-07-11,Young Adults,978-1-316-64345-7,General,1.7,492,French,"A gripping tale of adventure and self-discovery, following the journey of a young protagonist as they navigate through unexpected challenges and triumphs.",897,Commerce,Hard,No
Consider little.,Angela Carter,Lawson Group,2022-07-14,Thriller,1,2024-07-02,Teens,978-1-83399-756-9,General,4.4,104,Spanish,"A charming children's book that captivates young readers with its engaging story, colorful illustrations, and valuable life lessons.",254,Science,Medium,Yes
Mind street offer.,Larry Key,Diaz LLC,2016-05-11,Children's,10,Available,Children,978-0-02-813834-3,Reference,3.4,612,Japanese,"A heartwarming romance that follows the blossoming love between two characters, overcoming obstacles and finding true happiness.",251,Science,Hard,Yes
Couple police.,Vanessa Burns,Sanders-Le,2023-03-18,Self-Help,10,Available,Seniors,978-1-75591-147-6,Reference,4.6,249,French,"An insightful exploration of human emotions and relationships, delving deep into the complexities of love, loss, and personal growth.",768,Commerce,Hard,Yes
Camera admit.,Kevin Davis,Yates-Gray,2015-01-06,Romance,1,Available,Teens,978-1-249-98775-8,Reference,1.4,396,Spanish,"An intriguing exploration of the natural world, filled with stunning visuals and fascinating facts about various species.",609,Commerce,Medium,No
Price half they.,Jacob Parker,Walker Inc,2023-02-07,Non-Fiction,6,Available,Young Adults,978-0-9829509-7-5,Special Collection,1.5,680,Chinese,A comprehensive self-help guide offering practical advice and strategies for personal development and achieving life goals.,317,Commerce,Medium,Yes
Lot must.,Victoria Graves,Martin LLC,2021-08-08,Mystery,8,Available,Adults,978-1-69799-587-9,Reference,1.6,236,Japanese,"A humorous collection of anecdotes and stories that entertain and amuse, providing a lighthearted escape from everyday life.",605,Commerce,Hard,Yes
Cost.,Charles Hudson,Kennedy-Thompson,2019-06-23,Biography,8,Available,Children,978-1-391-33678-7,Special Collection,1.6,270,German,"An enchanting fantasy novel filled with magic, mythical creatures, and epic quests that transport readers to a fantastical realm.",288,Science,Medium,No
Cut alone.,Jennifer Curtis,Cantu Group,2017-10-08,Mystery,2,Available,Young Adults,978-0-220-24381-4,Reference,3.4,52,Spanish,"A poetic exploration of life's beauty and struggles, using evocative language and imagery to convey deep emotions.",256,Art,Hard,Yes
Set east his.,Michelle Gonzalez,"Weber, Lawson and Bates",2019-07-05,Fantasy,2,Available,Adults,978-1-61761-767-6,General,2.2,5,Spanish,"An insightful exploration of human emotions and relationships, delving deep into the complexities of love, loss, and personal growth.",434,Science,Easy,Yes
Nation successful.,Jeremy Clay,Stephenson Group,2020-05-28,Children's,2,2024-07-20,Seniors,978-0-324-08314-9,General,1.5,616,Japanese,"An educational science book that simplifies complex concepts, making them accessible and interesting for readers of all ages.",380,Science,Easy,Yes
World necessary almost.,Ashley King,"Hernandez, Bailey and Taylor",2017-03-05,Non-Fiction,3,Available,Young Adults,978-0-247-16116-0,Special Collection,2.0,845,English,"A charming children's book that captivates young readers with its engaging story, colorful illustrations, and valuable life lessons.",802,Science,Easy,No
Once easy fear.,Kelly Knox,Marshall LLC,2015-02-06,Fiction,2,Available,Children,978-0-901966-14-8,Special Collection,2.9,353,Chinese,"A poetic exploration of life's beauty and struggles, using evocative language and imagery to convey deep emotions.",115,Art,Hard,No
Tax those.,Daniel Powell,Garrett Group,2020-07-13,Non-Fiction,3,Available,Young Adults,978-0-8359-6279-7,Special Collection,4.2,551,Spanish,A comprehensive self-help guide offering practical advice and strategies for personal development and achieving life goals.,259,Commerce,Medium,No
Reduce here throw.,Jeremy Hill,"Hopkins, Peck and Flowers",2016-01-09,Mystery,0,Available,Teens,978-0-203-70106-5,Reserve,1.9,580,French,"A humorous collection of anecdotes and stories that entertain and amuse, providing a lighthearted escape from everyday life.",367,Commerce,Hard,Yes
Once sport.,Wayne Hickman,Clark-Le,2020-07-30,Mystery,8,Available,Adults,978-0-7127-1728-1,Special Collection,4.5,903,Chinese,"An educational science book that simplifies complex concepts, making them accessible and interesting for readers of all ages.",938,Art,Medium,Yes
Single action manage.,Michael Mckee,"Sharp, Salas and Salazar",2019-11-10,Thriller,2,Available,Children,978-1-297-99701-3,Reserve,3.4,696,French,"An inspiring story of resilience and determination, showcasing how the protagonist overcomes adversity to achieve their dreams.",747,Commerce,Easy,No
Join method.,Annette Brown,Smith Group,2024-03-21,Biography,7,Available,Adults,978-0-7568-3310-7,General,2.7,274,Spanish,"An intriguing exploration of the natural world, filled with stunning visuals and fascinating facts about various species.",178,Art,Medium,No
Suggest sort.,Mr. Christopher Glenn PhD,Lucas and Sons,2020-04-06,Non-Fiction,5,Available,Seniors,978-0-589-39177-5,Reference,2.8,887,French,"A fascinating history of significant events and figures that shaped the world, providing readers with a deeper understanding of the past.",745,Commerce,Easy,No
Receive hold sister.,Carrie Young,Mcclain Group,2018-08-21,Thriller,9,Available,Young Adults,978-0-7552-0188-4,General,4.9,327,Spanish,"An engaging analysis of contemporary social issues, encouraging readers to reflect on and challenge their perspectives.",548,Science,Medium,Yes
Thus surface personal.,Bonnie Dixon,Morrison-Brewer,2020-02-26,Fantasy,4,Available,Teens,978-1-197-55755-3,Special Collection,1.9,941,Japanese,"A thrilling mystery that keeps readers on the edge of their seats, unraveling secrets and twists with every turn of the page.",621,Art,Hard,Yes
Our culture.,Wayne Hernandez,"Dominguez, Guzman and Cruz",2014-07-05,Science Fiction,5,Available,Young Adults,978-1-4326-7193-8,Special Collection,3.2,31,English,A comprehensive self-help guide offering practical advice and strategies for personal development and achieving life goals.,647,Commerce,Easy,Yes
Score her establish.,Marissa Morales,Hernandez LLC,2022-01-17,Non-Fiction,10,Available,Children,978-1-58126-382-4,Special Collection,1.4,962,Chinese,A motivational book that empowers readers to take control of their lives and pursue their passions with confidence.,347,Science,Easy,Yes
Take until south.,Andrea Cobb,Walker-Murphy,2016-03-19,Self-Help,1,Available,Young Adults,978-0-03-672442-2,Reserve,2.6,519,Chinese,"A thrilling mystery that keeps readers on the edge of their seats, unraveling secrets and twists with every turn of the page.",534,Commerce,Easy,No
Alone four.,Frank James,Willis-Allen,2024-03-10,Mystery,6,Available,Children,978-0-15-331229-8,Special Collection,1.5,789,Japanese,"A poetic exploration of life's beauty and struggles, using evocative language and imagery to convey deep emotions.",863,Art,Hard,Yes
Spring argue last.,Vickie Bailey,"Hanna, Castro and Booth",2015-07-29,Mystery,4,Available,Young Adults,978-0-08-641952-1,Reference,2.5,916,English,"An insightful exploration of human emotions and relationships, delving deep into the complexities of love, loss, and personal growth.",345,Commerce,Easy,Yes
Minute speech increase.,Lisa Krause,Rivas and Sons,2020-01-24,Thriller,2,Available,Adults,978-1-60348-001-7,General,3.5,622,German,"A thought-provoking biography of a remarkable individual, highlighting their achievements, struggles, and contributions to society.",558,Art,Easy,Yes
Model about mother.,Megan Martinez,"Hodge, Spence and Scott",2021-06-09,Science Fiction,5,Available,Children,978-1-4043-1647-8,General,3.6,1,French,A suspenseful thriller that takes readers on a rollercoaster ride of unexpected events and shocking revelations.,758,Commerce,Medium,No
Bring brother ok.,Timothy Baker,Tucker Ltd,2022-12-05,Children's,10,Available,Young Adults,978-0-538-11632-9,Reserve,2.0,976,Chinese,"A captivating science fiction story set in a futuristic world, exploring the impact of technology on society and human interactions.",651,Commerce,Medium,Yes
Without save.,John Harris,"Munoz, Garcia and Trevino",2020-08-14,Thriller,8,2024-07-26,Teens,978-1-945640-80-3,Special Collection,3.6,591,Spanish,"An inspiring story of resilience and determination, showcasing how the protagonist overcomes adversity to achieve their dreams.",158,Science,Hard,Yes
Finally inside.,Andrew Hill,"Daniel, Wilson and Gray",2016-09-21,Fantasy,5,Available,Teens,978-1-343-36192-8,Special Collection,3.9,397,English,"An educational science book that simplifies complex concepts, making them accessible and interesting for readers of all ages.",799,Science,Easy,Yes
Yard again.,Melissa Harvey,Pitts LLC,2016-01-13,Thriller,8,2024-07-17,Young Adults,978-0-03-745204-1,Reference,3.0,246,French,"A humorous collection of anecdotes and stories that entertain and amuse, providing a lighthearted escape from everyday life.",477,Science,Hard,Yes
Find consider.,Stephanie Joseph,Moyer-Petersen,2017-10-08,Non-Fiction,2,Available,Young Adults,978-0-640-36076-4,General,1.3,471,German,"An inspiring story of resilience and determination, showcasing how the protagonist overcomes adversity to achieve their dreams.",208,Art,Hard,No
Home out important.,Shaun Sanchez,Cruz Inc,2016-02-18,Self-Help,6,Available,Seniors,978-1-367-02061-0,Reference,3.9,703,German,"A charming children's book that captivates young readers with its engaging story, colorful illustrations, and valuable life lessons.",536,Commerce,Easy,No
Back hand.,Yolanda Robinson,Harris-Garcia,2017-07-05,Thriller,8,2024-07-14,Children,978-0-344-62511-4,Reserve,2.4,686,German,A motivational book that empowers readers to take control of their lives and pursue their passions with confidence.,384,Art,Medium,Yes
Turn gun head.,Michael Jackson,"Petty, Hunt and Davidson",2023-11-25,Self-Help,4,Available,Teens,978-0-08-580621-6,Reference,3.9,947,Chinese,"An educational science book that simplifies complex concepts, making them accessible and interesting for readers of all ages.",681,Art,Easy,No
Brother begin.,Joshua Johnson,Williams LLC,2019-11-16,Mystery,3,Available,Adults,978-0-8424-6095-8,Reference,2.3,851,French,"A captivating science fiction story set in a futuristic world, exploring the impact of technology on society and human interactions.",692,Science,Hard,No
Same that capital.,Lynn Murphy,Taylor-Larson,2024-03-06,Mystery,6,Available,Teens,978-1-908432-83-4,Reserve,1.4,495,German,"An intriguing exploration of the natural world, filled with stunning visuals and fascinating facts about various species.",167,Commerce,Easy,No
Together concern piece.,Shawn Wilcox,Wang-Peterson,2022-09-11,Romance,5,Available,Seniors,978-0-563-96009-6,Reference,4.5,298,Japanese,"A captivating drama that delves into the complexities of family dynamics, loyalty, and the pursuit of personal identity.",758,Art,Hard,Yes
Tv figure husband fine.,Antonio Riley,"Mcdaniel, Estrada and Mcdonald",2018-12-21,Biography,6,Available,Seniors,978-0-309-19878-3,Special Collection,4.6,897,Japanese,"A humorous collection of anecdotes and stories that entertain and amuse, providing a lighthearted escape from everyday life.",610,Art,Easy,Yes
Good service evidence.,Tonya Murphy,Kelley LLC,2019-02-01,Children's,7,Available,Seniors,978-1-969736-18-6,General,2.7,129,French,A motivational book that empowers readers to take control of their lives and pursue their passions with confidence.,458,Science,Easy,No
Science future remain.,Alan Williams,Stone Inc,2019-06-29,Science Fiction,8,Available,Children,978-0-19-414988-4,Reserve,2.2,394,French,"An insightful exploration of human emotions and relationships, delving deep into the complexities of love, loss, and personal growth.",293,Science,Easy,Yes
Accept together.,Charles Martinez,"Eaton, Gonzalez and Murray",2014-11-02,Science Fiction,4,Available,Adults,978-1-386-72781-1,Special Collection,2.6,27,Chinese,"A thrilling mystery that keeps readers on the edge of their seats, unraveling secrets and twists with every turn of the page.",188,Science,Easy,No
Land head clear job.,Julie Maldonado,"Franklin, Williams and Jones",2019-11-15,Non-Fiction,6,2024-07-01,Young Adults,978-0-297-39252-1,Reference,3.4,222,French,A comprehensive self-help guide offering practical advice and strategies for personal development and achieving life goals.,289,Art,Easy,Yes
Bag race that.,Cody Franco Jr.,Case LLC,2017-12-24,Non-Fiction,6,Available,Children,978-1-916609-65-5,General,2.1,233,Japanese,"An engaging analysis of contemporary social issues, encouraging readers to reflect on and challenge their perspectives.",170,Commerce,Easy,Yes
Poor best.,Whitney Miller,Hernandez-Stewart,2019-10-06,Self-Help,1,Available,Young Adults,978-0-520-21267-1,Reserve,3.3,432,French,"A gripping tale of adventure and self-discovery, following the journey of a young protagonist as they navigate through unexpected challenges and triumphs.",131,Science,Medium,Yes
Structure at.,Jennifer Shelton,"Moody, Phelps and Harris",2015-05-06,Self-Help,10,Available,Children,978-1-898846-46-8,Special Collection,3.5,777,Chinese,"A detailed guide to understanding the intricacies of a specific field, offering expert insights and practical knowledge.",544,Art,Easy,No
Car bank.,Joseph Reyes,Bowman Ltd,2015-01-29,Children's,2,Available,Children,978-0-528-23345-6,Reference,1.1,674,French,"An intriguing exploration of the natural world, filled with stunning visuals and fascinating facts about various species.",226,Commerce,Easy,Yes
Pm boy professional.,Dustin Hart,Pennington-Harris,2018-10-05,Romance,2,Available,Seniors,978-0-461-68723-1,Special Collection,1.7,66,English,"A thought-provoking biography of a remarkable individual, highlighting their achievements, struggles, and contributions to society.",449,Science,Hard,No
Training southern stop.,Megan Williams,Watson-Collier,2024-04-27,Science Fiction,0,Available,Teens,978-1-872555-90-4,Special Collection,2.3,821,Japanese,A comprehensive self-help guide offering practical advice and strategies for personal development and achieving life goals.,706,Commerce,Hard,No
Research mission.,Shirley Wilkinson,Christian and Sons,2014-12-09,Thriller,9,Available,Young Adults,978-0-472-49170-4,General,3.4,95,English,A suspenseful thriller that takes readers on a rollercoaster ride of unexpected events and shocking revelations.,430,Science,Easy,No
Military.,Pamela Schroeder,Graham-Mcclure,2022-05-16,Mystery,9,Available,Teens,978-0-10-933682-8,Reserve,3.1,693,French,"An educational science book that simplifies complex concepts, making them accessible and interesting for readers of all ages.",216,Art,Hard,No
Word serve term.,Eric Howell,"Curtis, Russell and Stewart",2020-12-26,Biography,10,Available,Adults,978-0-930206-94-9,Special Collection,4.3,318,Japanese,"An insightful exploration of human emotions and relationships, delving deep into the complexities of love, loss, and personal growth.",800,Science,Easy,No
Major start argue.,Travis Torres,Gordon-Boyd,2024-01-07,Romance,8,Available,Teens,978-0-943713-16-8,Reserve,4.9,73,English,"A fascinating history of significant events and figures that shaped the world, providing readers with a deeper understanding of the past.",261,Science,Medium,Yes
Billion artist.,Bryan Charles,"Coleman, Ritter and Lara",2022-06-02,Self-Help,1,Available,Seniors,978-1-03-222865-5,Reserve,1.8,345,German,"A captivating science fiction story set in a futuristic world, exploring the impact of technology on society and human interactions.",439,Commerce,Medium,Yes
Between official.,Brian Butler,"Parker, Cox and Allison",2020-07-19,Fantasy,10,Available,Seniors,978-1-86967-509-7,Special Collection,1.2,814,French,"A gripping tale of adventure and self-discovery, following the journey of a young protagonist as they navigate through unexpected challenges and triumphs.",407,Science,Medium,Yes
Front campaign.,Jason Sims,Mccoy LLC,2018-11-08,Romance,3,Available,Teens,978-1-5048-5614-0,Reserve,4.1,722,Chinese,"An educational science book that simplifies complex concepts, making them accessible and interesting for readers of all ages.",643,Art,Hard,Yes
Likely much area specific.,Samantha Johnson,Mccoy Ltd,2021-11-12,Romance,9,Available,Children,978-0-15-624152-6,Special Collection,3.0,135,German,"A heartwarming romance that follows the blossoming love between two characters, overcoming obstacles and finding true happiness.",215,Science,Hard,No
Study foot.,Christopher Harrison,Campbell-Wilson,2017-02-12,Thriller,10,Available,Seniors,978-1-60754-235-3,Reserve,4.9,439,German,"A humorous collection of anecdotes and stories that entertain and amuse, providing a lighthearted escape from everyday life.",958,Science,Hard,No
Enjoy strategy.,Dustin Torres,Stuart-Graham,2014-10-25,Biography,9,Available,Teens,978-0-19-186892-4,General,3.6,117,Japanese,"A thought-provoking biography of a remarkable individual, highlighting their achievements, struggles, and contributions to society.",657,Science,Hard,Yes
Relationship public.,Brianna Phelps,"Hernandez, Martin and Potts",2021-01-09,Romance,8,Available,Adults,978-1-06-723187-3,Reference,5.0,115,French,"A fascinating history of significant events and figures that shaped the world, providing readers with a deeper understanding of the past.",238,Art,Hard,No
Little not.,Justin Patterson,"Cruz, Craig and Scott",2021-12-31,Fiction,1,Available,Seniors,978-1-71769-496-6,Special Collection,3.4,217,Chinese,"A charming children's book that captivates young readers with its engaging story, colorful illustrations, and valuable life lessons.",451,Art,Easy,No
Life add everything.,Jessica Smith,Meyer and Sons,2021-10-29,Romance,4,Available,Adults,978-1-894021-48-7,Reserve,3.3,104,Spanish,"An insightful exploration of human emotions and relationships, delving deep into the complexities of love, loss, and personal growth.",523,Commerce,Hard,No
May himself throughout.,Edwin Jimenez,"Sweeney, Martin and Davis",2016-04-11,Mystery,9,Available,Seniors,978-1-306-15476-5,Reference,4.3,178,Spanish,A comprehensive self-help guide offering practical advice and strategies for personal development and achieving life goals.,741,Commerce,Hard,Yes
Range bill.,Megan Owens,Zamora Ltd,2021-03-31,Science Fiction,2,Available,Seniors,978-1-145-30719-3,General,3.4,801,English,"A humorous collection of anecdotes and stories that entertain and amuse, providing a lighthearted escape from everyday life.",290,Science,Hard,Yes
