Book Name,Author,Publisher,Date Published,Genre,Availability,Return Date,Audience,ISBN,Library Section,Rating,Reviews,Language,Synopsis,Number of Pages,Parent Genre,Complexity,On Demand
Drive economic less.,Jeremiah Bernard,"Smith, Cummings and Kane",2020-10-31,Self-Help,2,Available,Children,978-1-227-43004-7,Reserve,1.3,146,French,"A charming children's book that captivates young readers with its engaging story, colorful illustrations, and valuable life lessons.",359,Art,Hard,Yes
Law argue.,Jeffrey Benson,Estrada-Taylor,2015-07-21,Self-Help,6,Available,Children,978-1-325-24257-3,Special Collection,2.8,305,Japanese,"An insightful exploration of human emotions and relationships, delving deep into the complexities of love, loss, and personal growth.",903,Commerce,Medium,Yes
Indeed.,Paul Welch,Davis-Brown,2017-12-11,Fiction,3,Available,Children,978-0-270-51479-7,Special Collection,4.2,40,Chinese,A motivational book that empowers readers to take control of their lives and pursue their passions with confidence.,204,Commerce,Hard,No
Walk purpose.,Claudia Smith,Nguyen Inc,2019-07-15,Mystery,3,Available,Seniors,978-1-227-53555-1,Reserve,3.0,105,Japanese,A suspenseful thriller that takes readers on a rollercoaster ride of unexpected events and shocking revelations.,252,Art,Hard,Yes
Else sit money president.,Michelle Miller,Rice-Brown,2023-08-18,Thriller,4,2024-07-03,Children,978-1-5150-0959-7,Reference,3.6,836,Chinese,"A gripping tale of adventure and self-discovery, following the journey of a young protagonist as they navigate through unexpected challenges and triumphs.",882,Science,Easy,Yes
Price late speak.,Anthony Gibbs,"Baker, Gonzalez and Hunter",2019-06-03,Romance,10,Available,Seniors,978-0-09-426904-0,General,2.2,810,Japanese,"A charming children's book that captivates young readers with its engaging story, colorful illustrations, and valuable life lessons.",997,Commerce,Hard,No
Nation military mouth.,Sharon Smith,"Weaver, Robinson and Powers",2020-09-09,Self-Help,0,2024-07-23,Seniors,978-0-609-07416-9,Special Collection,3.0,100,English,"A heartwarming romance that follows the blossoming love between two characters, overcoming obstacles and finding true happiness.",652,Science,Medium,Yes
Series society.,Amanda Hendrix,"Ramsey, Jordan and Rice",2017-02-18,Mystery,8,Available,Young Adults,978-0-930659-16-5,Special Collection,1.6,870,Spanish,"A charming children's book that captivates young readers with its engaging story, colorful illustrations, and valuable life lessons.",643,Commerce,Medium,Yes
Little.,Bobby Edwards,Pham-Campos,2016-12-03,Romance,8,Available,Seniors,978-0-01-592941-1,General,1.3,315,Spanish,"A detailed guide to understanding the intricacies of a specific field, offering expert insights and practical knowledge.",669,Commerce,Medium,No
My buy.,Sean Good,Marshall and Sons,2022-06-05,Biography,6,Available,Children,978-0-336-50541-7,Reserve,2.0,479,English,A motivational book that empowers readers to take control of their lives and pursue their passions with confidence.,727,Science,Medium,Yes
Wind mouth.,Amy Park,Davis-Lamb,2015-05-19,Children's,0,Available,Seniors,978-0-7102-9129-5,Reserve,3.0,842,Japanese,A suspenseful thriller that takes readers on a rollercoaster ride of unexpected events and shocking revelations.,694,Commerce,Medium,No
Call democratic energy.,Susan Nguyen,Williams Group,2023-07-20,Fantasy,1,Available,Teens,978-1-65059-600-6,Reference,3.8,314,French,"A gripping tale of adventure and self-discovery, following the journey of a young protagonist as they navigate through unexpected challenges and triumphs.",529,Commerce,Medium,Yes
Forward establish stop.,Tanner Murray,"Moore, Jones and Cortez",2019-07-22,Thriller,6,Available,Children,978-1-4143-2173-8,General,2.8,752,German,"A charming children's book that captivates young readers with its engaging story, colorful illustrations, and valuable life lessons.",929,Science,Hard,No
Model laugh attention.,Steven Woodward,Davis PLC,2015-08-31,Science Fiction,10,Available,Children,978-1-00-616873-4,General,1.5,143,German,A comprehensive self-help guide offering practical advice and strategies for personal development and achieving life goals.,821,Science,Medium,Yes
Day general.,Brian Thomas,Paul Inc,2015-09-15,Mystery,4,Available,Children,978-0-08-235479-6,Reference,3.1,438,German,"A poetic exploration of life's beauty and struggles, using evocative language and imagery to convey deep emotions.",962,Art,Hard,Yes
Investment eat happen.,Russell White,Bell Ltd,2015-07-24,Science Fiction,1,Available,Young Adults,978-0-88019-026-8,Special Collection,4.0,260,Chinese,"A heartwarming romance that follows the blossoming love between two characters, overcoming obstacles and finding true happiness.",119,Commerce,Easy,Yes
Usually people.,Steven Reyes,George-Larson,2015-02-08,Non-Fiction,9,2024-07-08,Children,978-1-373-12080-9,Reserve,2.7,785,Chinese,"A poetic exploration of life's beauty and struggles, using evocative language and imagery to convey deep emotions.",425,Art,Medium,Yes
Hold since story.,Denise Branch,Colon-Neal,2015-08-22,Children's,5,Available,Seniors,978-0-359-88663-0,General,1.9,370,German,"An insightful exploration of human emotions and relationships, delving deep into the complexities of love, loss, and personal growth.",287,Art,Hard,Yes
Since idea try.,Stephen Hubbard,Little Group,2020-12-30,Mystery,3,2024-07-06,Adults,978-1-01-117734-9,Reserve,1.5,265,English,"An inspiring story of resilience and determination, showcasing how the protagonist overcomes adversity to achieve their dreams.",509,Science,Hard,No
Significant.,Lisa White,Arnold Inc,2020-10-03,Thriller,10,2024-07-15,Teens,978-1-132-66919-8,Reserve,2.6,428,Chinese,"A captivating drama that delves into the complexities of family dynamics, loyalty, and the pursuit of personal identity.",984,Science,Medium,Yes
Sound analysis look low.,Eric Thompson,"Larson, Aguilar and Cooper",2016-03-23,Children's,8,Available,Seniors,978-0-18-996858-2,Special Collection,4.0,431,French,"An engaging analysis of contemporary social issues, encouraging readers to reflect on and challenge their perspectives.",843,Art,Hard,Yes
Though.,Jacob Smith,"Avila, Marshall and Ellis",2017-03-07,Science Fiction,10,Available,Seniors,978-1-63638-763-5,General,3.9,592,Spanish,"A captivating science fiction story set in a futuristic world, exploring the impact of technology on society and human interactions.",808,Science,Easy,No
Network speak.,Christy Stuart,"Medina, Phillips and Wright",2019-01-16,Mystery,4,2024-07-06,Seniors,978-0-9511969-9-1,General,3.4,831,Spanish,A suspenseful thriller that takes readers on a rollercoaster ride of unexpected events and shocking revelations.,638,Art,Easy,No
Indeed above.,Mrs. Shannon Kelly,"Harris, Sellers and Bailey",2022-11-18,Non-Fiction,3,Available,Teens,978-1-76393-695-9,Reference,3.1,529,French,"A fascinating history of significant events and figures that shaped the world, providing readers with a deeper understanding of the past.",830,Commerce,Easy,No
Put the.,Holly Ford,"Smith, Oneal and Snow",2022-11-02,Non-Fiction,3,Available,Young Adults,978-1-9791-1346-5,Reference,1.4,319,Japanese,"An insightful exploration of human emotions and relationships, delving deep into the complexities of love, loss, and personal growth.",407,Commerce,Easy,No
Husband current eight.,Robert Young,Taylor Group,2018-11-11,Biography,1,Available,Young Adults,978-1-4649-4626-4,Reserve,3.3,591,Japanese,"An engaging analysis of contemporary social issues, encouraging readers to reflect on and challenge their perspectives.",136,Science,Hard,Yes
Time stay might.,Ann Howell,West-Medina,2021-04-17,Romance,8,Available,Teens,978-1-5200-3345-7,Special Collection,3.8,823,Spanish,"A charming children's book that captivates young readers with its engaging story, colorful illustrations, and valuable life lessons.",814,Art,Medium,No
Issue third wife television.,David Duke,Mullen LLC,2019-08-12,Thriller,4,Available,Teens,978-0-678-93446-3,Reference,2.9,494,Chinese,"A captivating drama that delves into the complexities of family dynamics, loyalty, and the pursuit of personal identity.",932,Commerce,Hard,Yes
Buy cover able.,Kimberly Chapman,Bailey LLC,2022-05-21,Non-Fiction,10,Available,Seniors,978-0-09-977992-6,General,2.2,447,Spanish,"An intriguing exploration of the natural world, filled with stunning visuals and fascinating facts about various species.",892,Science,Medium,No
Peace true.,Daniel Nelson,"Reed, Garrett and Chen",2021-02-14,Biography,5,Available,Teens,978-0-288-44915-9,General,2.4,243,German,"A gripping tale of adventure and self-discovery, following the journey of a young protagonist as they navigate through unexpected challenges and triumphs.",431,Commerce,Hard,Yes
Black throughout.,Christopher Pham,Cunningham-Gill,2019-03-07,Self-Help,3,Available,Teens,978-0-7267-2207-3,General,2.9,720,English,"A heartwarming romance that follows the blossoming love between two characters, overcoming obstacles and finding true happiness.",795,Science,Medium,Yes
During sort.,Sean Koch,Watson Ltd,2018-05-07,Biography,5,2024-07-04,Teens,978-0-06-359861-4,Reserve,3.6,643,Chinese,"A captivating science fiction story set in a futuristic world, exploring the impact of technology on society and human interactions.",862,Art,Medium,Yes
Appear partner myself.,Nicholas Mayer,Buck-Cohen,2016-01-05,Children's,10,Available,Teens,978-0-8227-0721-9,Reference,3.7,183,Japanese,"A thought-provoking biography of a remarkable individual, highlighting their achievements, struggles, and contributions to society.",112,Commerce,Medium,Yes
State American investment.,Samuel Adkins,Hanna Group,2018-11-27,Fantasy,7,Available,Young Adults,978-1-148-97673-0,Special Collection,4.2,682,French,"A poetic exploration of life's beauty and struggles, using evocative language and imagery to convey deep emotions.",130,Art,Medium,No
Turn effort.,Stephen Ross,King-Bass,2014-11-13,Thriller,4,Available,Adults,978-1-384-34833-9,General,3.9,465,Chinese,"A thought-provoking biography of a remarkable individual, highlighting their achievements, struggles, and contributions to society.",113,Science,Easy,No
What order industry.,Dr. Anthony Ware,Pace LLC,2014-09-25,Romance,9,Available,Young Adults,978-1-70044-355-7,Special Collection,4.5,293,Chinese,"An enchanting fantasy novel filled with magic, mythical creatures, and epic quests that transport readers to a fantastical realm.",353,Commerce,Medium,Yes
Size realize bag.,Michael Avery,"Pearson, Jones and Rodriguez",2024-01-05,Romance,2,Available,Teens,978-0-320-08975-6,Reference,4.7,137,Spanish,"A charming children's book that captivates young readers with its engaging story, colorful illustrations, and valuable life lessons.",475,Art,Medium,No
Miss step whole later.,April Austin,Thompson-Daniels,2016-12-12,Thriller,2,Available,Seniors,978-1-314-69993-7,Reserve,3.5,99,Chinese,"A humorous collection of anecdotes and stories that entertain and amuse, providing a lighthearted escape from everyday life.",306,Science,Medium,Yes
Keep some country.,David Guerrero,Holland Group,2016-01-31,Mystery,0,Available,Young Adults,978-1-970662-10-8,General,2.5,576,Japanese,"An intriguing exploration of the natural world, filled with stunning visuals and fascinating facts about various species.",176,Commerce,Hard,No
Law debate either.,Megan Garcia,"Hamilton, Barr and Fields",2018-09-25,Fiction,8,Available,Teens,978-1-07-676867-4,General,4.6,186,Chinese,"A detailed guide to understanding the intricacies of a specific field, offering expert insights and practical knowledge.",311,Science,Easy,No
Item our.,Jordan Pruitt,Rice-Torres,2017-06-26,Thriller,8,Available,Children,978-1-01-665439-5,Reference,3.3,132,German,"An insightful exploration of human emotions and relationships, delving deep into the complexities of love, loss, and personal growth.",966,Commerce,Medium,No
Factor give particular.,Arthur Fields,"Dean, Smith and Gomez",2019-08-28,Fiction,5,Available,Teens,978-0-309-43357-0,Reserve,1.7,257,French,"A heartwarming romance that follows the blossoming love between two characters, overcoming obstacles and finding true happiness.",143,Commerce,Easy,Yes
Trip feeling.,Angel Roberson,Barnes-Cooper,2022-08-05,Non-Fiction,5,Available,Adults,978-1-09-014325-9,Reference,2.2,965,Spanish,A suspenseful thriller that takes readers on a rollercoaster ride of unexpected events and shocking revelations.,321,Science,Hard,Yes
Any result full north.,Lisa Wilson,"Murray, Meadows and Sherman",2022-01-13,Self-Help,9,2024-07-28,Teens,978-0-19-643983-9,Reference,4.5,799,Chinese,"An engaging analysis of contemporary social issues, encouraging readers to reflect on and challenge their perspectives.",761,Art,Easy,Yes
Why task every.,Douglas Garza,"Williams, Schultz and Miller",2017-05-31,Fiction,10,Available,Teens,978-1-09-324083-2,Reference,2.4,944,Chinese,"An insightful exploration of human emotions and relationships, delving deep into the complexities of love, loss, and personal growth.",709,Commerce,Easy,Yes
Newspaper.,Katie Young,"Chase, Jones and Arroyo",2019-03-09,Children's,0,Available,Seniors,978-1-60958-472-6,Special Collection,2.9,288,Chinese,"An engaging analysis of contemporary social issues, encouraging readers to reflect on and challenge their perspectives.",701,Science,Easy,No
Agent tonight star.,Barbara Cox,Gallagher Group,2015-06-06,Romance,2,Available,Children,978-1-234-62661-7,Special Collection,2.5,283,German,"A detailed guide to understanding the intricacies of a specific field, offering expert insights and practical knowledge.",290,Commerce,Medium,Yes
A appear.,Michael Perez,Cook-Roberts,2021-09-19,Biography,6,2024-07-11,Young Adults,978-0-458-25011-0,Reference,2.4,108,Chinese,"A humorous collection of anecdotes and stories that entertain and amuse, providing a lighthearted escape from everyday life.",454,Art,Medium,No
According believe.,Diana Moody,Horton PLC,2017-05-01,Fantasy,2,Available,Seniors,978-1-63541-773-9,Reference,4.8,324,English,"A charming children's book that captivates young readers with its engaging story, colorful illustrations, and valuable life lessons.",663,Commerce,Easy,No
Public.,Christopher Williamson,Morgan-Howard,2015-08-27,Biography,2,Available,Adults,978-0-598-22967-0,General,3.8,114,German,"A gripping tale of adventure and self-discovery, following the journey of a young protagonist as they navigate through unexpected challenges and triumphs.",655,Science,Hard,Yes
Move more finally.,Jennifer Bolton,"Mann, Moreno and Reese",2019-09-21,Non-Fiction,8,2024-07-19,Teens,978-0-7114-5513-9,Reserve,4.3,4,German,A motivational book that empowers readers to take control of their lives and pursue their passions with confidence.,385,Commerce,Easy,Yes
Decision investment weight.,Charles Gonzalez,Willis and Sons,2016-07-15,Fantasy,1,Available,Young Adults,978-0-13-744251-5,Special Collection,2.5,201,French,A suspenseful thriller that takes readers on a rollercoaster ride of unexpected events and shocking revelations.,528,Science,Easy,No
Fill later attention may.,Mark Frank,Rosales and Sons,2015-11-06,Children's,2,Available,Children,978-1-82356-031-5,Reference,2.4,67,French,A comprehensive self-help guide offering practical advice and strategies for personal development and achieving life goals.,917,Art,Medium,No
Industry himself.,Christopher Bowman,Perez-Anderson,2018-03-14,Fantasy,3,Available,Seniors,978-1-62801-239-2,General,4.5,590,German,"An educational science book that simplifies complex concepts, making them accessible and interesting for readers of all ages.",205,Art,Hard,No
Add tonight.,Morgan Pierce,Hicks PLC,2018-10-02,Fantasy,7,Available,Young Adults,978-1-4155-8262-6,Reserve,1.8,705,Chinese,A motivational book that empowers readers to take control of their lives and pursue their passions with confidence.,810,Art,Medium,Yes
May somebody security.,Brooke Roman,Fields-Davila,2017-11-19,Science Fiction,9,Available,Seniors,978-0-242-49199-6,Reserve,2.7,325,Japanese,"A humorous collection of anecdotes and stories that entertain and amuse, providing a lighthearted escape from everyday life.",605,Science,Medium,No
Leg push perform.,Nicholas Bishop,Zavala LLC,2015-07-07,Thriller,3,Available,Teens,978-1-217-19991-6,Reserve,4.0,542,Japanese,"A humorous collection of anecdotes and stories that entertain and amuse, providing a lighthearted escape from everyday life.",996,Art,Hard,No
Operation fill.,Jeffrey Mcdonald,"Harper, Ward and Garrett",2022-01-03,Romance,3,Available,Children,978-1-898009-50-4,Reference,3.3,46,French,"A captivating drama that delves into the complexities of family dynamics, loyalty, and the pursuit of personal identity.",805,Art,Medium,Yes
Bar meet.,Cindy Nunez,Jones Group,2018-06-14,Non-Fiction,2,Available,Teens,978-1-5171-0132-9,Special Collection,2.7,272,German,"A heartwarming romance that follows the blossoming love between two characters, overcoming obstacles and finding true happiness.",254,Science,Easy,No
Event lawyer else.,Melissa Martin,Stevens Group,2024-06-20,Non-Fiction,3,Available,Teens,978-1-880519-01-1,Reference,2.9,617,German,"A humorous collection of anecdotes and stories that entertain and amuse, providing a lighthearted escape from everyday life.",535,Art,Medium,No
Defense easy view.,Anthony Rose,Williams PLC,2024-02-07,Biography,6,Available,Seniors,978-1-56451-656-5,General,1.6,667,English,"An inspiring story of resilience and determination, showcasing how the protagonist overcomes adversity to achieve their dreams.",716,Science,Hard,No
Pick southern.,Meghan Garcia,"Smith, Roy and Kelly",2022-06-02,Thriller,5,Available,Children,978-0-00-761102-7,General,1.2,497,Spanish,"A heartwarming romance that follows the blossoming love between two characters, overcoming obstacles and finding true happiness.",107,Science,Hard,No
Sometimes create.,Emily Castillo,Farrell-Phillips,2022-02-13,Romance,9,Available,Adults,978-0-8369-5437-1,Reserve,1.8,437,German,"An intriguing exploration of the natural world, filled with stunning visuals and fascinating facts about various species.",467,Art,Easy,Yes
Group can.,Cynthia Mosley,Phillips-Frazier,2019-01-23,Non-Fiction,9,Available,Teens,978-1-56565-692-5,Special Collection,3.0,918,German,"A poetic exploration of life's beauty and struggles, using evocative language and imagery to convey deep emotions.",280,Commerce,Hard,No
Recently firm billion.,Timothy Davis,"Patton, Hamilton and Vang",2016-07-18,Mystery,2,Available,Teens,978-0-266-90387-1,General,1.0,123,German,"A fascinating history of significant events and figures that shaped the world, providing readers with a deeper understanding of the past.",700,Commerce,Hard,Yes
Hospital.,Scott Kane,Green-Chavez,2022-09-26,Thriller,10,Available,Adults,978-0-210-14867-9,General,1.4,174,Spanish,"An educational science book that simplifies complex concepts, making them accessible and interesting for readers of all ages.",589,Science,Hard,Yes
Forget under worry air.,Crystal Garcia DVM,"Hardin, Dickson and Wade",2022-10-13,Mystery,7,2024-07-27,Seniors,978-1-67141-684-0,General,3.1,263,Spanish,"An intriguing exploration of the natural world, filled with stunning visuals and fascinating facts about various species.",441,Art,Easy,No
Dark consider apply.,Nicole Gibson,Jones PLC,2017-08-09,Non-Fiction,1,Available,Children,978-1-4117-7412-4,Reserve,3.7,700,Japanese,"A captivating drama that delves into the complexities of family dynamics, loyalty, and the pursuit of personal identity.",107,Science,Easy,Yes
General good.,Megan Stephens,"Howard, Mills and Fields",2023-10-12,Thriller,9,Available,Seniors,978-0-559-00463-6,Reserve,1.4,722,Spanish,"A captivating drama that delves into the complexities of family dynamics, loyalty, and the pursuit of personal identity.",100,Commerce,Easy,No
Concern later.,Adrienne Beasley,"Franklin, Smith and Dunlap",2022-10-20,Biography,0,Available,Young Adults,978-0-250-05811-2,General,1.5,199,Japanese,"An educational science book that simplifies complex concepts, making them accessible and interesting for readers of all ages.",372,Science,Medium,Yes
Town notice them.,Julie Hill,"Hendricks, Fields and Townsend",2017-01-29,Thriller,8,Available,Teens,978-0-426-12227-2,Reserve,2.7,237,English,"An educational science book that simplifies complex concepts, making them accessible and interesting for readers of all ages.",315,Art,Easy,Yes
Type.,Victoria Abbott,Brown-Reeves,2015-05-25,Fantasy,9,Available,Teens,978-0-8284-7242-5,General,3.1,612,Japanese,A motivational book that empowers readers to take control of their lives and pursue their passions with confidence.,638,Art,Easy,Yes
Society rise anything.,Stephanie Clayton,Sanford-Howe,2019-05-13,Children's,5,Available,Adults,978-0-7463-2634-3,Reference,1.1,321,Japanese,"An educational science book that simplifies complex concepts, making them accessible and interesting for readers of all ages.",688,Art,Hard,Yes
Appear appear.,Caleb Mason,"Johnson, Krause and Jones",2021-04-29,Thriller,7,Available,Young Adults,978-0-9810911-2-9,Reserve,2.5,973,Japanese,"A fascinating history of significant events and figures that shaped the world, providing readers with a deeper understanding of the past.",660,Science,Easy,No
Another record.,Katrina Herrera,"Hickman, Ortega and Campbell",2021-01-10,Children's,7,Available,Adults,978-0-609-51842-7,General,1.5,184,French,"An enchanting fantasy novel filled with magic, mythical creatures, and epic quests that transport readers to a fantastical realm.",870,Science,Hard,Yes
Up or bar.,David Carroll,"Martinez, Martin and Duncan",2016-06-17,Mystery,4,Available,Teens,978-0-664-77480-6,General,4.4,847,Spanish,"An intriguing exploration of the natural world, filled with stunning visuals and fascinating facts about various species.",280,Science,Medium,Yes
Clear recognize story.,Patrick Romero,James and Sons,2023-07-31,Romance,0,Available,Young Adults,978-0-563-40599-3,Special Collection,3.1,38,Chinese,A motivational book that empowers readers to take control of their lives and pursue their passions with confidence.,830,Art,Hard,Yes
Individual religious office.,Thomas Smith,"Hutchinson, Gonzalez and Delgado",2015-08-14,Non-Fiction,3,Available,Teens,978-1-56657-505-8,Special Collection,1.9,938,Chinese,"A thrilling mystery that keeps readers on the edge of their seats, unraveling secrets and twists with every turn of the page.",502,Commerce,Medium,No
Both.,Tiffany Livingston,"Evans, Tucker and Mcintosh",2015-03-21,Children's,8,Available,Children,978-1-4074-9839-3,Reference,2.8,53,Spanish,"An intriguing exploration of the natural world, filled with stunning visuals and fascinating facts about various species.",721,Science,Medium,Yes
Natural traditional stop.,Todd Phelps,Johnson PLC,2022-10-11,Self-Help,10,Available,Young Adults,978-1-4924-6874-5,Reserve,1.4,1,Chinese,"A gripping tale of adventure and self-discovery, following the journey of a young protagonist as they navigate through unexpected challenges and triumphs.",585,Art,Medium,Yes
Other white response.,Marco Delgado,Wong-Reed,2023-08-31,Biography,2,Available,Adults,978-0-8159-9213-4,Reference,1.8,200,Japanese,"An inspiring story of resilience and determination, showcasing how the protagonist overcomes adversity to achieve their dreams.",677,Commerce,Hard,No
Truth know fact.,Donald Fisher,Trevino-Gonzalez,2019-01-07,Children's,10,Available,Young Adults,978-0-03-240514-1,Reference,1.4,896,Chinese,"A gripping tale of adventure and self-discovery, following the journey of a young protagonist as they navigate through unexpected challenges and triumphs.",969,Commerce,Medium,Yes
Performance bit future lawyer.,Danielle Dixon,Dudley and Sons,2020-10-24,Fantasy,7,Available,Young Adults,978-1-59463-965-4,Reference,4.9,97,German,"A poetic exploration of life's beauty and struggles, using evocative language and imagery to convey deep emotions.",602,Science,Medium,Yes
Likely three.,Jose White,"Lawson, Cunningham and Morales",2022-10-13,Mystery,7,Available,Seniors,978-0-8444-4495-6,Reference,4.8,742,Spanish,A motivational book that empowers readers to take control of their lives and pursue their passions with confidence.,307,Commerce,Hard,No
From no garden official.,Richard Perez,Stewart Inc,2024-01-30,Science Fiction,8,Available,Seniors,978-1-951486-35-8,General,1.3,703,Spanish,A comprehensive self-help guide offering practical advice and strategies for personal development and achieving life goals.,328,Commerce,Easy,Yes
Girl particular light.,Anthony Vargas,Nelson-Bradley,2019-12-17,Fantasy,5,Available,Young Adults,978-0-641-14287-1,General,1.3,50,Chinese,"A humorous collection of anecdotes and stories that entertain and amuse, providing a lighthearted escape from everyday life.",476,Science,Easy,Yes
Republican nice remain.,Devon Hernandez,"Jordan, Gray and Solomon",2019-06-16,Science Fiction,1,Available,Teens,978-0-607-58640-4,Special Collection,4.8,905,German,"A detailed guide to understanding the intricacies of a specific field, offering expert insights and practical knowledge.",594,Art,Medium,Yes
Wear black conference when.,Gregory Armstrong,"Watson, King and Johns",2014-09-06,Fiction,4,Available,Young Adults,978-0-16-468540-4,Special Collection,1.7,949,German,"An inspiring story of resilience and determination, showcasing how the protagonist overcomes adversity to achieve their dreams.",704,Commerce,Medium,No
Sell firm.,Alice Vaughan,Krueger Ltd,2016-12-31,Children's,2,Available,Seniors,978-1-58147-726-9,Reference,4.7,507,Japanese,"A charming children's book that captivates young readers with its engaging story, colorful illustrations, and valuable life lessons.",471,Art,Hard,Yes
Every sort.,Christine Adams,Carter PLC,2016-11-02,Mystery,9,Available,Adults,978-0-268-98998-9,Special Collection,3.3,93,Spanish,"An inspiring story of resilience and determination, showcasing how the protagonist overcomes adversity to achieve their dreams.",659,Art,Easy,No
