Book Name,Author,Publisher,Date Published,Genre,Availability,Return Date,Audience,ISBN,Library Section,Rating,Reviews,Language,Synopsis,Number of Pages,Parent Genre,Complexity,On Demand
Job development move.,Ashley Gonzales,Armstrong PLC,2023-10-26,Fiction,6,Available,Adults,978-1-62267-049-9,Reserve,2.7,728,Chinese,"A gripping tale of adventure and self-discovery, following the journey of a young protagonist as they navigate through unexpected challenges and triumphs.",315,Commerce,Medium,No
Popular yard camera society.,Catherine Woodard,Harris Group,2020-06-28,Thriller,9,Available,Teens,978-0-7641-1507-3,Reserve,2.6,60,German,A motivational book that empowers readers to take control of their lives and pursue their passions with confidence.,278,Commerce,Medium,No
Grow another speech account.,Claudia Archer,"Goodwin, King and Wilson",2018-09-02,Children's,6,Available,Teens,978-1-393-38808-1,General,4.2,921,Japanese,"An educational science book that simplifies complex concepts, making them accessible and interesting for readers of all ages.",848,Science,Hard,Yes
Mrs laugh middle.,Garrett Maddox,Garcia Ltd,2019-06-11,Non-Fiction,2,Available,Children,978-0-19-794928-3,Special Collection,2.1,412,Japanese,"An educational science book that simplifies complex concepts, making them accessible and interesting for readers of all ages.",860,Commerce,Hard,Yes
Ready live.,Christopher Moore,Franklin PLC,2015-03-17,Fantasy,0,Available,Seniors,978-1-266-97690-2,Special Collection,4.8,222,French,"A humorous collection of anecdotes and stories that entertain and amuse, providing a lighthearted escape from everyday life.",420,Commerce,Medium,Yes
War be.,Albert Meyer,"Perez, Harris and Price",2024-01-15,Non-Fiction,2,Available,Seniors,978-1-390-26809-6,Reference,3.4,442,French,"A thought-provoking biography of a remarkable individual, highlighting their achievements, struggles, and contributions to society.",982,Science,Easy,No
Enjoy contain.,Cynthia Byrd,"Snyder, Miller and Sanchez",2022-04-20,Children's,9,Available,Teens,978-0-7969-6619-3,General,1.9,844,Japanese,"An intriguing exploration of the natural world, filled with stunning visuals and fascinating facts about various species.",855,Art,Easy,No
Require article theory.,James Moss,Ortega-Garcia,2018-03-21,Fantasy,0,Available,Adults,978-1-234-88062-0,Reference,2.2,934,English,A comprehensive self-help guide offering practical advice and strategies for personal development and achieving life goals.,260,Commerce,Medium,No
Understand experience.,Julia George,Hansen Group,2020-08-01,Mystery,7,2024-06-30,Teens,978-0-559-65223-3,General,3.4,464,French,"An educational science book that simplifies complex concepts, making them accessible and interesting for readers of all ages.",713,Art,Hard,Yes
Network much.,Daniel Brennan,Hall-Williamson,2016-09-16,Mystery,2,Available,Children,978-0-217-58818-8,Special Collection,1.0,601,Spanish,"An enchanting fantasy novel filled with magic, mythical creatures, and epic quests that transport readers to a fantastical realm.",104,Science,Easy,No
Century improve.,Lee Greene,Ramsey-Jones,2024-03-28,Science Fiction,5,Available,Teens,978-0-461-99811-5,Reserve,2.6,128,German,"A captivating drama that delves into the complexities of family dynamics, loyalty, and the pursuit of personal identity.",813,Commerce,Hard,No
Offer can.,Karen Stein,"Nelson, Kim and Johnson",2018-04-18,Non-Fiction,0,Available,Teens,978-0-15-559892-8,General,5.0,802,English,"An inspiring story of resilience and determination, showcasing how the protagonist overcomes adversity to achieve their dreams.",831,Commerce,Easy,No
Ball husband.,Anthony Gonzalez,Bell Group,2017-11-17,Romance,7,Available,Seniors,978-0-7272-5847-2,Reserve,2.0,769,Japanese,"A thrilling mystery that keeps readers on the edge of their seats, unraveling secrets and twists with every turn of the page.",406,Commerce,Hard,No
When imagine.,Debra Manning,Brady-Reyes,2019-12-29,Self-Help,10,Available,Teens,978-0-7281-4520-7,General,1.2,839,German,"An inspiring story of resilience and determination, showcasing how the protagonist overcomes adversity to achieve their dreams.",546,Art,Easy,No
Person simply.,Michael Smith,Terrell-Munoz,2023-04-27,Non-Fiction,10,Available,Teens,978-1-9995465-2-6,Special Collection,1.7,395,German,"An engaging analysis of contemporary social issues, encouraging readers to reflect on and challenge their perspectives.",525,Commerce,Hard,Yes
Wear score yes.,Michael Chapman,Crawford LLC,2023-07-02,Fiction,4,Available,Seniors,978-1-181-49639-4,Reference,2.8,40,French,"A thought-provoking biography of a remarkable individual, highlighting their achievements, struggles, and contributions to society.",963,Science,Medium,No
Throughout animal.,Deborah Cowan,"Davis, Carpenter and Roberts",2023-11-29,Mystery,9,Available,Seniors,978-1-86836-434-3,Reserve,3.4,573,French,"An inspiring story of resilience and determination, showcasing how the protagonist overcomes adversity to achieve their dreams.",971,Commerce,Hard,No
Something beautiful catch.,Teresa Roberts,Robertson Group,2020-10-25,Romance,3,Available,Teens,978-0-322-50423-3,Special Collection,4.3,804,Spanish,"An engaging analysis of contemporary social issues, encouraging readers to reflect on and challenge their perspectives.",147,Commerce,Easy,Yes
Tonight fill large.,Christopher Henry,Horne-Cummings,2020-08-17,Non-Fiction,1,Available,Children,978-0-7072-2399-5,General,4.4,3,English,"A detailed guide to understanding the intricacies of a specific field, offering expert insights and practical knowledge.",296,Art,Easy,No
Add wonder we.,Charles Johnson,"Collins, Mann and Lopez",2017-01-10,Mystery,8,Available,Children,978-1-72330-868-0,Special Collection,3.9,515,French,"An intriguing exploration of the natural world, filled with stunning visuals and fascinating facts about various species.",675,Science,Medium,No
Win Mr source.,Stephen Johnson,"Gomez, Williamson and Sanchez",2022-09-21,Science Fiction,6,Available,Young Adults,978-0-935069-39-6,Special Collection,2.3,253,Spanish,A suspenseful thriller that takes readers on a rollercoaster ride of unexpected events and shocking revelations.,175,Art,Medium,No
Human.,William Bowen,Tyler Group,2015-07-12,Thriller,4,2024-07-23,Children,978-0-85241-868-0,Special Collection,3.6,547,Chinese,"An insightful exploration of human emotions and relationships, delving deep into the complexities of love, loss, and personal growth.",975,Science,Medium,No
Part friend either.,Kimberly Collins,"Wood, Anderson and Alexander",2016-10-25,Biography,2,Available,Young Adults,978-0-7366-6077-8,Reference,3.0,593,Chinese,"A heartwarming romance that follows the blossoming love between two characters, overcoming obstacles and finding true happiness.",919,Science,Hard,No
Subject will.,Gregory Hunter,Reid LLC,2020-03-01,Non-Fiction,8,Available,Seniors,978-0-244-13336-8,Reference,4.1,374,English,A motivational book that empowers readers to take control of their lives and pursue their passions with confidence.,607,Science,Medium,No
Show first national.,Matthew Morris,"Fisher, Hansen and Hicks",2020-12-26,Science Fiction,2,Available,Adults,978-1-140-08763-2,General,3.1,31,Spanish,"A detailed guide to understanding the intricacies of a specific field, offering expert insights and practical knowledge.",983,Art,Medium,Yes
Join score.,Bryan Heath,"Wells, Moreno and Huff",2023-12-12,Mystery,1,Available,Seniors,978-1-62240-543-5,General,1.9,795,German,"A captivating science fiction story set in a futuristic world, exploring the impact of technology on society and human interactions.",283,Art,Medium,No
Change close.,Kelly Barnett,Miller Ltd,2015-02-03,Fiction,10,Available,Young Adults,978-1-66897-516-9,Reference,2.1,134,French,A motivational book that empowers readers to take control of their lives and pursue their passions with confidence.,935,Art,Easy,No
Police support.,Jeffrey Schultz,Hammond LLC,2018-02-02,Fiction,10,Available,Seniors,978-0-8068-3996-7,Special Collection,4.4,91,Spanish,"A detailed guide to understanding the intricacies of a specific field, offering expert insights and practical knowledge.",854,Science,Easy,No
As cold protect.,Michele Hopkins,Ferrell-Booth,2017-10-19,Fiction,2,2024-07-21,Adults,978-1-4899-5382-7,Reserve,3.3,537,English,A motivational book that empowers readers to take control of their lives and pursue their passions with confidence.,335,Science,Medium,Yes
Might participant.,Daniel Watson,"Sanders, Garner and Mason",2022-03-01,Fantasy,9,Available,Children,978-0-04-146816-8,Reserve,4.9,108,German,A comprehensive self-help guide offering practical advice and strategies for personal development and achieving life goals.,570,Science,Easy,Yes
Way note each.,Mary Williams,Lopez LLC,2016-11-02,Mystery,1,Available,Children,978-0-87399-579-5,Reference,4.2,225,Chinese,"A heartwarming romance that follows the blossoming love between two characters, overcoming obstacles and finding true happiness.",911,Commerce,Easy,No
Watch.,Marco Payne,Velasquez-Clark,2023-03-29,Thriller,8,Available,Teens,978-0-273-44294-3,General,2.0,719,French,"An inspiring story of resilience and determination, showcasing how the protagonist overcomes adversity to achieve their dreams.",922,Commerce,Medium,Yes
Crime may environmental.,Mark White,"Miller, Huff and Moreno",2017-08-02,Biography,10,2024-07-05,Adults,978-0-443-05735-9,Reserve,3.8,721,Chinese,"An educational science book that simplifies complex concepts, making them accessible and interesting for readers of all ages.",806,Art,Medium,No
Be where few whole.,Jean Webb,Casey-Foster,2022-02-28,Biography,8,Available,Children,978-1-132-33524-6,Reserve,2.3,995,German,"An engaging analysis of contemporary social issues, encouraging readers to reflect on and challenge their perspectives.",842,Commerce,Hard,Yes
Take find prove.,Ashley Rodgers,"Lopez, Wilson and Davis",2018-01-06,Children's,9,Available,Young Adults,978-0-04-523802-6,General,4.3,914,Spanish,"An intriguing exploration of the natural world, filled with stunning visuals and fascinating facts about various species.",572,Art,Medium,Yes
Wait simple.,Isabel Obrien,Herrera-White,2016-07-01,Fiction,6,Available,Young Adults,978-1-387-13189-1,Reference,2.2,985,Chinese,"A gripping tale of adventure and self-discovery, following the journey of a young protagonist as they navigate through unexpected challenges and triumphs.",112,Art,Medium,No
Heart attention current.,Betty Coleman,Hudson-Holmes,2018-03-19,Children's,6,Available,Young Adults,978-0-495-99308-7,General,4.5,168,German,"A heartwarming romance that follows the blossoming love between two characters, overcoming obstacles and finding true happiness.",502,Science,Hard,Yes
Position treatment.,Stephen Clark,Smith Group,2015-07-14,Romance,4,Available,Adults,978-1-924692-84-7,Special Collection,2.9,397,French,"An engaging analysis of contemporary social issues, encouraging readers to reflect on and challenge their perspectives.",214,Art,Hard,Yes
Expect really.,Keith Boone,Bryant and Sons,2018-08-20,Romance,4,Available,Adults,978-1-07-228192-4,General,3.8,380,Spanish,"A captivating drama that delves into the complexities of family dynamics, loyalty, and the pursuit of personal identity.",991,Commerce,Medium,Yes
Represent young participant.,Julie Mooney,"Howell, Foster and Gilbert",2024-06-17,Self-Help,4,Available,Children,978-1-108-17349-0,Special Collection,2.7,211,Chinese,"An educational science book that simplifies complex concepts, making them accessible and interesting for readers of all ages.",368,Science,Hard,No
Personal wish.,Nicholas Cook,Morris PLC,2018-10-10,Biography,0,Available,Young Adults,978-1-349-42733-8,Reserve,4.9,73,Japanese,"A thrilling mystery that keeps readers on the edge of their seats, unraveling secrets and twists with every turn of the page.",319,Commerce,Easy,No
Suddenly yourself.,Kristin Taylor,Patterson-Jimenez,2017-05-07,Thriller,6,Available,Teens,978-0-7974-8496-2,Reserve,1.7,418,French,"A fascinating history of significant events and figures that shaped the world, providing readers with a deeper understanding of the past.",699,Commerce,Medium,No
Provide difficult class.,Kenneth Hampton,"Nunez, Newman and Moore",2017-12-25,Science Fiction,4,Available,Teens,978-1-218-21869-2,Special Collection,4.9,962,French,A comprehensive self-help guide offering practical advice and strategies for personal development and achieving life goals.,495,Art,Easy,Yes
Particular agreement pick.,Frank Washington,"Jones, Hill and Kelly",2019-07-21,Fantasy,4,Available,Children,978-0-612-99179-8,Reference,3.7,203,Japanese,"An insightful exploration of human emotions and relationships, delving deep into the complexities of love, loss, and personal growth.",292,Commerce,Medium,No
Cold challenge society.,Melissa Davis,"Mcdaniel, Daniel and Jensen",2017-10-23,Self-Help,8,Available,Seniors,978-0-7465-7540-6,General,1.8,729,Chinese,"An intriguing exploration of the natural world, filled with stunning visuals and fascinating facts about various species.",190,Commerce,Easy,Yes
Foot company.,William Pitts,Howard-Deleon,2019-04-07,Children's,8,Available,Teens,978-0-426-93744-9,Reference,4.4,780,French,"A charming children's book that captivates young readers with its engaging story, colorful illustrations, and valuable life lessons.",203,Art,Medium,Yes
Service remain.,Kyle Carroll,"Lewis, Weiss and Williams",2016-01-12,Mystery,8,2024-07-25,Teens,978-0-9519290-7-0,Reference,3.6,147,German,"An insightful exploration of human emotions and relationships, delving deep into the complexities of love, loss, and personal growth.",222,Science,Easy,No
Learn structure.,Julia Burton,Stephens Inc,2019-01-28,Fiction,5,Available,Seniors,978-0-203-96031-8,Special Collection,5.0,730,Chinese,"A detailed guide to understanding the intricacies of a specific field, offering expert insights and practical knowledge.",513,Art,Hard,No
Then imagine.,Jerry Dennis,Robbins-Gregory,2024-03-26,Science Fiction,5,Available,Teens,978-1-79635-459-1,Reference,2.8,238,Chinese,A suspenseful thriller that takes readers on a rollercoaster ride of unexpected events and shocking revelations.,862,Science,Hard,No
Place adult.,Andre Carey,Rios-Morgan,2023-06-10,Science Fiction,3,Available,Adults,978-0-8159-1701-4,Reserve,2.8,481,Japanese,A motivational book that empowers readers to take control of their lives and pursue their passions with confidence.,850,Commerce,Easy,Yes
Tough keep.,Ariana Sanders,"Tran, Blankenship and Moses",2023-01-29,Mystery,6,2024-07-15,Young Adults,978-1-326-43963-7,General,3.5,628,Japanese,"An educational science book that simplifies complex concepts, making them accessible and interesting for readers of all ages.",838,Commerce,Easy,No
Up small Democrat their.,Michelle Jones,"Shaw, Boyd and Ramos",2015-10-02,Biography,2,Available,Children,978-1-169-31058-2,General,4.1,420,Chinese,"A captivating drama that delves into the complexities of family dynamics, loyalty, and the pursuit of personal identity.",312,Commerce,Hard,No
Culture ok learn.,Kristy Smith,Jones-Haynes,2017-04-23,Biography,0,Available,Young Adults,978-0-08-958131-7,Reference,1.8,306,German,"A thrilling mystery that keeps readers on the edge of their seats, unraveling secrets and twists with every turn of the page.",419,Commerce,Easy,Yes
School inside.,Paul Fletcher,Rivera PLC,2021-02-17,Biography,8,2024-07-18,Adults,978-0-7560-8347-2,General,3.2,361,Japanese,"A fascinating history of significant events and figures that shaped the world, providing readers with a deeper understanding of the past.",115,Commerce,Medium,Yes
Seat soldier.,Cody Dudley,Flores PLC,2020-04-16,Non-Fiction,2,Available,Seniors,978-0-04-661682-3,Reserve,4.4,161,English,"A thrilling mystery that keeps readers on the edge of their seats, unraveling secrets and twists with every turn of the page.",218,Commerce,Medium,No
Property respond.,Lisa Franco,"Powell, Holland and Rodriguez",2018-06-07,Biography,10,Available,Seniors,978-0-347-21232-8,Reserve,1.4,753,German,"A captivating drama that delves into the complexities of family dynamics, loyalty, and the pursuit of personal identity.",471,Art,Hard,Yes
Our child.,Eric Johnson,Montoya Ltd,2023-06-18,Children's,9,Available,Seniors,978-0-05-915635-4,Special Collection,1.9,855,Spanish,"A humorous collection of anecdotes and stories that entertain and amuse, providing a lighthearted escape from everyday life.",922,Science,Hard,Yes
Here suddenly.,Jonathan Cox,Gallegos PLC,2016-09-02,Fiction,6,Available,Teens,978-1-913266-32-5,Reserve,2.9,738,English,"An insightful exploration of human emotions and relationships, delving deep into the complexities of love, loss, and personal growth.",640,Commerce,Hard,No
Compare American.,James Williamson,"Long, Kelley and Trevino",2015-02-07,Fiction,5,Available,Young Adults,978-0-04-151135-2,Reserve,4.7,282,Japanese,"A humorous collection of anecdotes and stories that entertain and amuse, providing a lighthearted escape from everyday life.",325,Art,Medium,Yes
Involve finally.,Amanda Baker,Romero LLC,2023-10-11,Mystery,7,Available,Seniors,978-1-86547-436-6,Reserve,4.0,304,Spanish,"An inspiring story of resilience and determination, showcasing how the protagonist overcomes adversity to achieve their dreams.",679,Art,Medium,No
Above must.,Jared Lopez,Sparks-Herrera,2023-07-22,Science Fiction,0,Available,Seniors,978-0-257-83954-7,Reserve,4.3,717,German,"A thrilling mystery that keeps readers on the edge of their seats, unraveling secrets and twists with every turn of the page.",984,Art,Hard,No
Something firm.,Alisha Monroe,"Martin, Fox and Harris",2021-08-31,Science Fiction,8,Available,Adults,978-1-4633-9251-2,Reference,1.1,901,Japanese,"An inspiring story of resilience and determination, showcasing how the protagonist overcomes adversity to achieve their dreams.",130,Commerce,Hard,Yes
Its.,Thomas Lewis,Anthony-Morris,2017-06-15,Children's,6,Available,Teens,978-0-518-56279-5,General,4.7,406,Japanese,"A poetic exploration of life's beauty and struggles, using evocative language and imagery to convey deep emotions.",499,Art,Hard,Yes
Analysis such may.,Amanda Howard,"Beltran, Evans and Barrett",2018-01-20,Mystery,10,Available,Young Adults,978-1-940948-57-7,Special Collection,3.7,383,French,"A humorous collection of anecdotes and stories that entertain and amuse, providing a lighthearted escape from everyday life.",990,Commerce,Hard,Yes
Almost attention result.,Rita Carrillo,Yang-Anderson,2023-09-12,Biography,9,Available,Children,978-1-85522-969-3,General,3.8,244,Chinese,"A thought-provoking biography of a remarkable individual, highlighting their achievements, struggles, and contributions to society.",138,Commerce,Hard,No
Seat.,Sarah Hodge,White LLC,2023-05-15,Self-Help,3,Available,Adults,978-0-220-55162-9,General,1.9,957,Spanish,"An educational science book that simplifies complex concepts, making them accessible and interesting for readers of all ages.",241,Commerce,Hard,No
Industry star term religious.,Steven Williams,Bradshaw-Reynolds,2015-08-07,Thriller,0,Available,Young Adults,978-1-310-82775-4,Reference,3.2,885,Chinese,"A gripping tale of adventure and self-discovery, following the journey of a young protagonist as they navigate through unexpected challenges and triumphs.",206,Commerce,Medium,Yes
Read better tend.,Krista Hendricks,Herrera and Sons,2019-10-27,Science Fiction,5,Available,Teens,978-0-8014-6304-4,Reference,3.6,249,Japanese,"A humorous collection of anecdotes and stories that entertain and amuse, providing a lighthearted escape from everyday life.",240,Art,Medium,No
Shoulder order middle.,Nichole Smith,Bennett-Williams,2018-10-09,Mystery,8,Available,Young Adults,978-1-5264-4149-2,Reserve,2.3,720,Spanish,"An inspiring story of resilience and determination, showcasing how the protagonist overcomes adversity to achieve their dreams.",808,Science,Hard,No
Western marriage that.,Crystal Williams,"White, Johnson and Rowe",2022-11-08,Non-Fiction,2,Available,Young Adults,978-0-08-917640-7,Special Collection,1.4,203,German,"A humorous collection of anecdotes and stories that entertain and amuse, providing a lighthearted escape from everyday life.",177,Art,Medium,Yes
Opportunity instead.,Ryan Meyers,"Griffith, Lambert and Haynes",2015-03-16,Romance,10,Available,Children,978-0-248-17080-2,Reference,2.9,423,Japanese,"A poetic exploration of life's beauty and struggles, using evocative language and imagery to convey deep emotions.",556,Art,Easy,No
Ever beat.,Scott Jones,"Atkinson, Kim and Stephenson",2015-03-05,Fantasy,3,Available,Young Adults,978-0-7504-2885-9,Reserve,3.9,672,Japanese,"A humorous collection of anecdotes and stories that entertain and amuse, providing a lighthearted escape from everyday life.",476,Science,Hard,Yes
Go story next bit.,Jonathon Roman,"Garcia, Martinez and Mcmillan",2017-10-04,Fiction,10,2024-07-20,Teens,978-0-638-91784-0,Reserve,2.9,642,German,"A humorous collection of anecdotes and stories that entertain and amuse, providing a lighthearted escape from everyday life.",321,Art,Easy,No
Of clear.,Pamela Haynes,Ross and Sons,2016-04-16,Mystery,5,Available,Adults,978-0-7220-5096-5,Reserve,4.9,938,Spanish,"An intriguing exploration of the natural world, filled with stunning visuals and fascinating facts about various species.",736,Art,Hard,No
Candidate agency friend take.,Kenneth Fox,Brown-Gonzalez,2016-04-28,Science Fiction,10,Available,Children,978-1-169-87609-5,Reserve,2.2,140,English,A motivational book that empowers readers to take control of their lives and pursue their passions with confidence.,268,Science,Hard,No
Get dog especially.,Daniel Cohen,Johnson PLC,2023-07-14,Thriller,7,Available,Adults,978-1-927279-92-2,General,3.6,414,Spanish,"An inspiring story of resilience and determination, showcasing how the protagonist overcomes adversity to achieve their dreams.",809,Commerce,Medium,Yes
Her hospital.,Megan Nicholson,"Wright, Chavez and Hinton",2014-07-29,Non-Fiction,0,Available,Adults,978-0-545-82930-4,General,4.8,998,Spanish,"A thought-provoking biography of a remarkable individual, highlighting their achievements, struggles, and contributions to society.",824,Art,Easy,No
Service whole test.,Sandra Johnson,Smith LLC,2023-06-09,Mystery,3,Available,Children,978-1-139-70843-2,Special Collection,2.9,288,Japanese,"An insightful exploration of human emotions and relationships, delving deep into the complexities of love, loss, and personal growth.",802,Art,Easy,Yes
Out capital.,Maria Smith,Hendrix LLC,2019-05-08,Self-Help,9,Available,Young Adults,978-0-10-006902-2,General,3.5,769,French,A comprehensive self-help guide offering practical advice and strategies for personal development and achieving life goals.,374,Science,Medium,No
Act despite.,Paul Berry,"Anderson, Singh and Luna",2018-04-08,Biography,3,Available,Seniors,978-0-18-314537-8,Special Collection,1.5,934,French,"An insightful exploration of human emotions and relationships, delving deep into the complexities of love, loss, and personal growth.",935,Science,Medium,No
Hour air.,Glenda Cantrell,Hernandez and Sons,2017-08-07,Mystery,4,Available,Seniors,978-1-256-35048-4,Special Collection,3.2,843,Spanish,"A charming children's book that captivates young readers with its engaging story, colorful illustrations, and valuable life lessons.",976,Science,Easy,Yes
Job catch.,Carol Anderson,Jones-Flowers,2017-09-23,Self-Help,2,Available,Adults,978-0-585-75263-1,General,4.9,920,English,"A charming children's book that captivates young readers with its engaging story, colorful illustrations, and valuable life lessons.",183,Science,Hard,Yes
Dark maintain.,Corey Chan,Spears-Wright,2021-03-22,Non-Fiction,6,Available,Adults,978-1-84317-245-1,General,1.2,211,Chinese,"A humorous collection of anecdotes and stories that entertain and amuse, providing a lighthearted escape from everyday life.",975,Commerce,Hard,Yes
Side want trade.,Emily Rivera,Johnson PLC,2023-03-12,Non-Fiction,1,Available,Seniors,978-1-61156-041-1,Special Collection,3.3,172,Japanese,"An inspiring story of resilience and determination, showcasing how the protagonist overcomes adversity to achieve their dreams.",770,Commerce,Medium,No
Reduce family.,James Boyd,"Acosta, Shaffer and Hanna",2021-04-07,Thriller,9,Available,Seniors,978-0-504-12114-2,Reference,4.8,859,Chinese,"A poetic exploration of life's beauty and struggles, using evocative language and imagery to convey deep emotions.",803,Art,Medium,Yes
Deep result.,Robert Hunt,Moore-Rogers,2020-11-13,Romance,7,Available,Seniors,978-1-03-609088-3,Special Collection,4.9,42,Japanese,"A fascinating history of significant events and figures that shaped the world, providing readers with a deeper understanding of the past.",526,Science,Hard,No
Whom blue chance.,Shelia Anthony,Ferrell Ltd,2015-05-21,Romance,3,Available,Teens,978-1-940503-30-1,Reference,1.9,325,Chinese,"A detailed guide to understanding the intricacies of a specific field, offering expert insights and practical knowledge.",428,Commerce,Hard,No
Important hospital.,Jessica Sherman,Maddox LLC,2021-12-10,Biography,7,Available,Teens,978-0-18-924963-6,Special Collection,1.1,680,German,"An inspiring story of resilience and determination, showcasing how the protagonist overcomes adversity to achieve their dreams.",834,Commerce,Easy,No
Throw thought local.,Ashley Phillips,"Simpson, Stewart and Miller",2020-03-24,Biography,8,Available,Children,978-0-11-360080-9,General,1.4,348,Spanish,"A captivating science fiction story set in a futuristic world, exploring the impact of technology on society and human interactions.",397,Art,Hard,No
Deep near.,Jessica Walker,"Kim, Anderson and Foster",2020-12-26,Non-Fiction,1,Available,Young Adults,978-0-04-357612-0,Reserve,2.3,919,German,"A detailed guide to understanding the intricacies of a specific field, offering expert insights and practical knowledge.",766,Commerce,Easy,No
