Book Name,Author,Publisher,Date Published,Genre,Availability,Return Date,Audience,ISBN,Library Section,Rating,Reviews,Language,Synopsis,Number of Pages,Parent Genre,Complexity,On Demand
Else its some.,Garrett Watts,"Brown, Lopez and Johnson",2019-03-23,Romance,1,Available,Seniors,978-0-579-16103-6,Reference,2.4,190,English,"An intriguing exploration of the natural world, filled with stunning visuals and fascinating facts about various species.",483,Commerce,Hard,Yes
Chair anything scene.,Ryan Gonzalez,Stephens Inc,2018-04-03,Non-Fiction,5,Available,Seniors,978-0-487-66438-4,General,2.7,250,English,A motivational book that empowers readers to take control of their lives and pursue their passions with confidence.,979,Commerce,Medium,Yes
Animal feel.,Tina Smith,"Brown, Miller and Gomez",2017-01-23,Fiction,1,2024-07-13,Adults,978-0-598-72635-3,General,5.0,786,English,"A thought-provoking biography of a remarkable individual, highlighting their achievements, struggles, and contributions to society.",357,Science,Medium,No
Find body.,Gregory Martinez,Butler-Cohen,2020-02-14,Children's,1,Available,Seniors,978-0-7006-2718-9,Special Collection,1.5,755,French,"A charming children's book that captivates young readers with its engaging story, colorful illustrations, and valuable life lessons.",680,Commerce,Hard,Yes
May.,Brian Baxter Jr.,Leon Ltd,2023-08-24,Romance,0,Available,Young Adults,978-1-4316-8497-7,Special Collection,1.1,944,German,"A captivating drama that delves into the complexities of family dynamics, loyalty, and the pursuit of personal identity.",744,Science,Medium,Yes
Skill mother move relate.,Kyle Fernandez,Rodriguez Inc,2015-09-23,Children's,5,Available,Teens,978-0-213-93904-5,Reserve,3.1,189,German,A motivational book that empowers readers to take control of their lives and pursue their passions with confidence.,124,Commerce,Easy,Yes
Author religious personal.,Lisa Gomez,"Jordan, Martinez and Dalton",2017-07-31,Biography,0,Available,Children,978-0-481-44894-2,Reference,2.5,520,Japanese,A suspenseful thriller that takes readers on a rollercoaster ride of unexpected events and shocking revelations.,186,Science,Medium,No
Instead clear cold.,Willie Miller,York Inc,2021-11-17,Non-Fiction,2,Available,Adults,978-0-571-58042-2,General,4.6,839,Japanese,"A thought-provoking biography of a remarkable individual, highlighting their achievements, struggles, and contributions to society.",382,Science,Medium,No
Model dream opportunity.,Julie Diaz,Burns-Davis,2020-07-18,Children's,6,Available,Children,978-1-01-581722-7,General,1.1,610,German,"An engaging analysis of contemporary social issues, encouraging readers to reflect on and challenge their perspectives.",238,Commerce,Hard,No
History decide safe.,Kari Ross,Brennan and Sons,2015-06-17,Mystery,9,Available,Seniors,978-0-555-25354-0,General,3.2,629,German,"An educational science book that simplifies complex concepts, making them accessible and interesting for readers of all ages.",550,Science,Medium,No
With over view.,Abigail Thomas,"Lee, Thomas and Smith",2016-08-21,Science Fiction,10,Available,Adults,978-1-933978-54-3,General,3.6,168,French,"An educational science book that simplifies complex concepts, making them accessible and interesting for readers of all ages.",382,Science,Medium,No
Production role area.,Charles Jones,Walsh Group,2014-07-16,Self-Help,0,Available,Young Adults,978-0-324-14266-2,Reference,2.7,836,French,"An intriguing exploration of the natural world, filled with stunning visuals and fascinating facts about various species.",985,Commerce,Easy,No
Case later avoid.,Corey Terry,Davis-Schwartz,2021-07-23,Mystery,5,Available,Children,978-1-119-25011-1,Special Collection,2.2,281,Japanese,"An engaging analysis of contemporary social issues, encouraging readers to reflect on and challenge their perspectives.",401,Commerce,Medium,No
Recognize country than leader.,Taylor Shaw,Neal Inc,2019-12-05,Non-Fiction,7,Available,Teens,978-1-4013-9619-0,Reserve,2.3,703,English,"A detailed guide to understanding the intricacies of a specific field, offering expert insights and practical knowledge.",962,Art,Hard,Yes
Factor everything.,Jeffrey Howell,"Mendoza, Zimmerman and Wagner",2015-08-12,Thriller,8,2024-07-06,Seniors,978-0-267-23833-0,General,1.2,449,Spanish,"A heartwarming romance that follows the blossoming love between two characters, overcoming obstacles and finding true happiness.",175,Science,Medium,Yes
Require.,Adrian Shaw,Smith PLC,2024-04-18,Fantasy,7,Available,Young Adults,978-1-82526-670-3,Special Collection,5.0,851,German,"A captivating drama that delves into the complexities of family dynamics, loyalty, and the pursuit of personal identity.",648,Art,Hard,Yes
Remain town.,Patricia Perkins,Smith-Rodriguez,2020-08-19,Fiction,7,Available,Adults,978-1-84149-487-6,Reserve,2.1,470,English,"A captivating drama that delves into the complexities of family dynamics, loyalty, and the pursuit of personal identity.",179,Science,Medium,No
Tv program.,Robert Jones,Vance Group,2024-03-13,Self-Help,1,Available,Adults,978-0-618-57381-3,General,5.0,140,Chinese,"A captivating science fiction story set in a futuristic world, exploring the impact of technology on society and human interactions.",708,Art,Medium,No
Way get try.,Thomas York,Wilson-Ochoa,2023-11-28,Romance,0,Available,Seniors,978-1-895173-98-7,Reference,2.3,221,French,"A captivating drama that delves into the complexities of family dynamics, loyalty, and the pursuit of personal identity.",242,Science,Easy,No
Education hundred traditional far.,Michelle Hernandez,Roberts-Flores,2015-06-02,Biography,8,Available,Young Adults,978-0-9530903-2-7,General,4.2,276,Spanish,"A detailed guide to understanding the intricacies of a specific field, offering expert insights and practical knowledge.",701,Art,Easy,No
Me water.,Rodney Williams,"Love, Woodard and Parrish",2019-07-11,Fantasy,6,Available,Children,978-1-5383-7377-4,Reserve,2.3,838,German,"An engaging analysis of contemporary social issues, encouraging readers to reflect on and challenge their perspectives.",222,Science,Medium,Yes
Her stay.,Victoria Porter,"Huff, Alvarez and Parks",2024-05-08,Romance,4,Available,Children,978-0-492-31312-3,Reserve,1.3,191,French,"A thrilling mystery that keeps readers on the edge of their seats, unraveling secrets and twists with every turn of the page.",167,Commerce,Easy,No
Everything Mrs.,Mrs. Christine Smith,"King, Holt and Gonzalez",2017-06-02,Biography,0,Available,Children,978-0-9708603-1-6,Reference,4.9,717,English,A motivational book that empowers readers to take control of their lives and pursue their passions with confidence.,644,Science,Easy,Yes
Seat design.,Thomas Williams,Gamble Ltd,2017-05-03,Non-Fiction,10,Available,Young Adults,978-1-5265-8400-7,Reference,2.3,126,German,"A thought-provoking biography of a remarkable individual, highlighting their achievements, struggles, and contributions to society.",350,Commerce,Easy,Yes
Low office citizen.,Lisa Oneill,"Brennan, Ryan and Carey",2016-03-21,Fiction,8,Available,Adults,978-1-84446-291-9,Reserve,3.3,676,German,A suspenseful thriller that takes readers on a rollercoaster ride of unexpected events and shocking revelations.,709,Commerce,Medium,No
Truth moment.,Jacqueline Rivers,Porter-Flores,2016-05-01,Fiction,1,Available,Adults,978-1-937499-01-3,Reference,1.5,227,Chinese,"An intriguing exploration of the natural world, filled with stunning visuals and fascinating facts about various species.",157,Commerce,Easy,No
Now series.,Michael Salinas,Miranda-Gonzalez,2020-01-12,Romance,1,Available,Adults,978-1-85298-815-9,Reference,1.2,142,Spanish,"A detailed guide to understanding the intricacies of a specific field, offering expert insights and practical knowledge.",233,Art,Easy,No
Manager describe.,Bradley Gonzalez,Stanley LLC,2022-05-17,Mystery,5,Available,Teens,978-0-8219-5363-1,Reference,4.7,85,French,"A thought-provoking biography of a remarkable individual, highlighting their achievements, struggles, and contributions to society.",675,Science,Medium,No
Yard paper add person.,Edward Taylor,Moore-Lawson,2023-11-18,Fiction,5,Available,Young Adults,978-0-605-22007-2,Reserve,3.4,276,German,"A captivating science fiction story set in a futuristic world, exploring the impact of technology on society and human interactions.",444,Commerce,Hard,No
Store chair single.,Ashley Smith,Rice-Davidson,2014-12-08,Thriller,1,Available,Adults,978-1-57135-187-6,General,2.1,460,German,"A detailed guide to understanding the intricacies of a specific field, offering expert insights and practical knowledge.",805,Science,Medium,Yes
Off any.,Jacob Jones,"Thompson, Valdez and Michael",2016-10-29,Children's,7,Available,Adults,978-0-469-59817-1,General,4.2,481,Spanish,A motivational book that empowers readers to take control of their lives and pursue their passions with confidence.,982,Commerce,Easy,No
Loss call test.,Sara Hughes,"Bell, Sanchez and Mcbride",2016-05-11,Children's,0,Available,Seniors,978-0-17-695210-5,Reserve,4.4,353,French,A comprehensive self-help guide offering practical advice and strategies for personal development and achieving life goals.,198,Commerce,Hard,No
Than education side want.,Cynthia Edwards,"Baker, Todd and Hurley",2015-11-26,Fantasy,2,Available,Children,978-0-06-670270-4,Special Collection,3.9,665,Chinese,"A poetic exploration of life's beauty and struggles, using evocative language and imagery to convey deep emotions.",177,Commerce,Medium,Yes
Deal capital.,Tiffany Mcneil,"Schmidt, Lane and Brown",2023-11-19,Fantasy,8,Available,Adults,978-0-529-36057-1,Special Collection,1.9,9,Chinese,"An intriguing exploration of the natural world, filled with stunning visuals and fascinating facts about various species.",905,Art,Easy,No
Sport simple perform.,Javier Gonzalez,Fuller PLC,2020-10-08,Non-Fiction,10,Available,Young Adults,978-0-352-18976-9,Reserve,3.1,147,English,"A captivating drama that delves into the complexities of family dynamics, loyalty, and the pursuit of personal identity.",243,Art,Hard,Yes
Produce front.,Jeffrey Estrada MD,"Scott, Martin and Harrison",2017-07-27,Thriller,4,Available,Adults,978-1-899482-87-0,Reference,2.3,200,Japanese,A comprehensive self-help guide offering practical advice and strategies for personal development and achieving life goals.,873,Science,Medium,No
Thing common.,Joseph Williams,Davis PLC,2022-07-13,Thriller,0,Available,Teens,978-0-554-11433-0,General,3.2,359,Chinese,A motivational book that empowers readers to take control of their lives and pursue their passions with confidence.,690,Commerce,Hard,No
Force arm.,Timothy Evans,"Schmidt, Schwartz and Mitchell",2022-05-12,Self-Help,0,Available,Adults,978-1-05-813809-9,Reserve,4.3,719,Spanish,A suspenseful thriller that takes readers on a rollercoaster ride of unexpected events and shocking revelations.,947,Science,Easy,No
Bed quite.,Tina Reynolds,Roberson Inc,2019-05-23,Thriller,6,Available,Adults,978-1-09-179992-9,Special Collection,1.6,252,Chinese,"A gripping tale of adventure and self-discovery, following the journey of a young protagonist as they navigate through unexpected challenges and triumphs.",279,Art,Easy,No
Pattern success.,Ricky Hernandez,"Lewis, Mccullough and Nelson",2019-11-01,Mystery,5,Available,Adults,978-0-7210-4569-6,General,2.8,44,English,"A charming children's book that captivates young readers with its engaging story, colorful illustrations, and valuable life lessons.",951,Commerce,Easy,No
Trip approach.,Nathaniel Murphy,Spencer-Bowman,2016-01-23,Non-Fiction,2,Available,Seniors,978-0-7122-9727-1,Reference,2.5,937,Spanish,"A detailed guide to understanding the intricacies of a specific field, offering expert insights and practical knowledge.",886,Art,Easy,No
Beyond season.,Amy Bray,Maynard Inc,2024-05-13,Science Fiction,8,Available,Seniors,978-0-7630-2935-7,General,5.0,19,English,"An inspiring story of resilience and determination, showcasing how the protagonist overcomes adversity to achieve their dreams.",458,Science,Hard,No
Final production detail.,Teresa Berry,"Morgan, Lopez and Hudson",2014-11-01,Self-Help,2,Available,Young Adults,978-0-227-49054-9,Special Collection,3.8,263,Chinese,"An educational science book that simplifies complex concepts, making them accessible and interesting for readers of all ages.",237,Science,Medium,No
Always though person.,Sandra Buckley,Davidson Ltd,2023-06-01,Children's,2,Available,Adults,978-0-425-01254-3,General,1.3,877,Spanish,"A charming children's book that captivates young readers with its engaging story, colorful illustrations, and valuable life lessons.",366,Commerce,Hard,No
To.,Brittany Rivera,Gaines-Brown,2015-03-23,Self-Help,2,Available,Seniors,978-1-4876-4235-8,Reserve,4.0,191,German,"A gripping tale of adventure and self-discovery, following the journey of a young protagonist as they navigate through unexpected challenges and triumphs.",640,Science,Hard,No
Half rate face.,April Yu,"Smith, Meadows and Mahoney",2017-08-28,Non-Fiction,2,Available,Young Adults,978-1-264-74350-6,Reserve,4.8,937,German,A comprehensive self-help guide offering practical advice and strategies for personal development and achieving life goals.,585,Commerce,Easy,Yes
Read.,Kim Scott,Roberts-Walton,2014-11-11,Non-Fiction,10,Available,Young Adults,978-0-621-20644-9,Reference,4.9,588,Spanish,A suspenseful thriller that takes readers on a rollercoaster ride of unexpected events and shocking revelations.,768,Art,Easy,Yes
Develop stand course.,Scott Crane,"Robinson, Costa and Allen",2020-05-25,Self-Help,10,Available,Adults,978-1-989716-58-8,General,2.5,37,Japanese,"An inspiring story of resilience and determination, showcasing how the protagonist overcomes adversity to achieve their dreams.",830,Art,Easy,Yes
Man space my.,Derek Roberts,Mason LLC,2023-09-10,Non-Fiction,3,Available,Seniors,978-0-692-03973-1,General,2.3,448,French,"A thought-provoking biography of a remarkable individual, highlighting their achievements, struggles, and contributions to society.",384,Art,Easy,No
Unit near radio.,Melissa Avila,Haney-Aguirre,2014-08-24,Non-Fiction,9,Available,Teens,978-0-7960-0616-5,General,2.3,266,Chinese,"A thrilling mystery that keeps readers on the edge of their seats, unraveling secrets and twists with every turn of the page.",350,Science,Medium,Yes
Improve administration.,Robert Cain,"Turner, Schmidt and Huang",2019-05-12,Self-Help,5,Available,Young Adults,978-1-365-32536-6,General,3.5,1000,Japanese,"An educational science book that simplifies complex concepts, making them accessible and interesting for readers of all ages.",816,Art,Medium,Yes
Son really much.,William Cross,"Rodriguez, Patrick and Lowe",2023-10-10,Science Fiction,0,Available,Children,978-0-671-67640-7,Reference,2.7,367,Chinese,"A gripping tale of adventure and self-discovery, following the journey of a young protagonist as they navigate through unexpected challenges and triumphs.",986,Commerce,Hard,Yes
Myself him simple.,Alexis Carroll,"Copeland, Davis and Lopez",2021-04-22,Fiction,7,Available,Adults,978-0-7403-0804-8,Reserve,4.5,911,English,"An enchanting fantasy novel filled with magic, mythical creatures, and epic quests that transport readers to a fantastical realm.",650,Art,Easy,Yes
Ok senior.,Julian Christian,"Ryan, Francis and Nunez",2020-09-11,Romance,10,Available,Adults,978-0-336-59925-6,General,4.2,594,English,"A poetic exploration of life's beauty and struggles, using evocative language and imagery to convey deep emotions.",876,Art,Medium,Yes
Mean play.,Michael Lee,"Koch, Crawford and Gill",2020-10-01,Self-Help,10,Available,Adults,978-1-08-118419-3,General,4.8,108,German,"A fascinating history of significant events and figures that shaped the world, providing readers with a deeper understanding of the past.",103,Commerce,Easy,No
Well risk.,Frank Griffin,Phillips-Hodges,2022-02-12,Self-Help,6,Available,Young Adults,978-1-285-87134-9,Reserve,3.5,642,Japanese,"A gripping tale of adventure and self-discovery, following the journey of a young protagonist as they navigate through unexpected challenges and triumphs.",401,Art,Medium,No
Realize song.,Jacqueline Miller,"Smith, Smith and Jones",2016-03-02,Fiction,0,Available,Children,978-1-311-61606-7,Reserve,1.1,669,English,"A humorous collection of anecdotes and stories that entertain and amuse, providing a lighthearted escape from everyday life.",319,Commerce,Easy,No
Style one various.,Peter Nelson,"Murphy, Mccarthy and Mcknight",2022-09-26,Romance,3,Available,Teens,978-0-9670698-2-1,Special Collection,4.0,987,English,"A captivating drama that delves into the complexities of family dynamics, loyalty, and the pursuit of personal identity.",457,Science,Easy,No
Might particular.,Justin Brown,Brown Ltd,2021-02-21,Biography,3,Available,Young Adults,978-1-343-54641-7,General,4.2,384,Spanish,"A thrilling mystery that keeps readers on the edge of their seats, unraveling secrets and twists with every turn of the page.",300,Commerce,Hard,No
Factor past another.,Richard Sanchez,Lucas PLC,2023-12-04,Mystery,10,Available,Teens,978-0-8361-5710-9,General,2.7,276,Japanese,"An insightful exploration of human emotions and relationships, delving deep into the complexities of love, loss, and personal growth.",491,Commerce,Hard,No
Level morning.,David Obrien,"Fuller, Arias and Thomas",2022-08-12,Non-Fiction,4,2024-07-16,Adults,978-1-276-02504-1,Special Collection,2.3,330,Japanese,A suspenseful thriller that takes readers on a rollercoaster ride of unexpected events and shocking revelations.,605,Art,Hard,No
These chair.,Brandon Diaz,"Dean, Cooper and Osborne",2023-03-10,Biography,5,Available,Children,978-0-675-94608-7,Reference,4.8,411,Japanese,"An inspiring story of resilience and determination, showcasing how the protagonist overcomes adversity to achieve their dreams.",435,Art,Medium,No
Lawyer one detail son.,Kelly Holloway,Moss-Butler,2018-08-12,Non-Fiction,2,Available,Seniors,978-1-57672-820-8,Reserve,1.9,349,English,"A poetic exploration of life's beauty and struggles, using evocative language and imagery to convey deep emotions.",361,Science,Hard,No
Share should.,Brian Andrade,Watson-Long,2022-09-28,Non-Fiction,3,Available,Young Adults,978-1-80057-405-2,Reserve,1.5,385,Japanese,"An inspiring story of resilience and determination, showcasing how the protagonist overcomes adversity to achieve their dreams.",113,Commerce,Hard,No
Room position.,David Richardson,Rodriguez Inc,2019-01-16,Biography,5,Available,Teens,978-1-72388-606-5,General,2.2,360,German,"A captivating drama that delves into the complexities of family dynamics, loyalty, and the pursuit of personal identity.",709,Art,Hard,Yes
Energy manager.,Andrew Hoffman,"Blackwell, Day and Daniels",2019-08-25,Fiction,3,2024-07-11,Teens,978-1-317-63946-6,Reference,1.2,858,Spanish,"A poetic exploration of life's beauty and struggles, using evocative language and imagery to convey deep emotions.",906,Science,Easy,No
Find growth appear.,Christina Mccarthy,Pham-Gomez,2023-02-12,Biography,2,Available,Adults,978-1-200-12603-5,General,4.8,324,Spanish,"An enchanting fantasy novel filled with magic, mythical creatures, and epic quests that transport readers to a fantastical realm.",248,Science,Medium,Yes
Plant method.,Kevin Castillo,Edwards Inc,2021-01-01,Biography,6,Available,Children,978-0-277-82693-0,Reserve,2.8,197,German,"A captivating science fiction story set in a futuristic world, exploring the impact of technology on society and human interactions.",371,Art,Easy,Yes
Stay arrive dark.,Kimberly Howard,White-Jones,2019-04-20,Science Fiction,7,Available,Children,978-0-920529-05-8,Reserve,1.6,538,Spanish,"A gripping tale of adventure and self-discovery, following the journey of a young protagonist as they navigate through unexpected challenges and triumphs.",335,Art,Easy,No
Face gas.,Cameron Williams,"Gonzales, Walker and Estes",2016-09-24,Fiction,5,Available,Teens,978-0-351-44386-2,Reserve,3.0,931,Japanese,"An intriguing exploration of the natural world, filled with stunning visuals and fascinating facts about various species.",411,Commerce,Hard,Yes
Stage their case store.,Jackson Maynard,Moran and Sons,2022-06-28,Fantasy,9,2024-07-21,Seniors,978-0-683-58235-2,Reserve,2.6,311,English,"An intriguing exploration of the natural world, filled with stunning visuals and fascinating facts about various species.",407,Art,Medium,Yes
For among.,Ashley Richardson,Farley Inc,2015-12-10,Biography,2,Available,Children,978-1-360-78203-4,General,3.4,677,Spanish,"A detailed guide to understanding the intricacies of a specific field, offering expert insights and practical knowledge.",243,Science,Medium,No
Other rock soon.,Jamie Hale,Williams-Golden,2023-03-04,Non-Fiction,6,Available,Teens,978-1-4013-7807-3,General,3.4,720,Spanish,"A fascinating history of significant events and figures that shaped the world, providing readers with a deeper understanding of the past.",353,Science,Easy,No
Likely pay.,Stephanie Griffin,Kramer LLC,2018-07-02,Children's,9,Available,Teens,978-0-431-72106-4,Special Collection,4.3,500,Chinese,"A thought-provoking biography of a remarkable individual, highlighting their achievements, struggles, and contributions to society.",432,Art,Easy,Yes
Interesting chance.,David Jenkins Jr.,Rowe LLC,2016-10-29,Science Fiction,0,Available,Children,978-0-10-761737-0,Reserve,4.6,868,Japanese,"A captivating drama that delves into the complexities of family dynamics, loyalty, and the pursuit of personal identity.",255,Commerce,Easy,No
Its fish.,Terry Heath,Kim-Hunter,2017-01-28,Fantasy,2,Available,Seniors,978-0-428-03400-9,Reserve,3.5,736,English,A suspenseful thriller that takes readers on a rollercoaster ride of unexpected events and shocking revelations.,674,Science,Hard,No
Difficult.,Julie Becker,Clark Group,2017-05-06,Fiction,9,Available,Adults,978-1-06-130116-9,Reserve,3.2,892,Spanish,"An educational science book that simplifies complex concepts, making them accessible and interesting for readers of all ages.",188,Commerce,Hard,Yes
One provide physical.,David Wilson,Wilson Inc,2018-01-07,Fantasy,0,Available,Adults,978-0-244-36010-8,General,2.3,201,English,"A humorous collection of anecdotes and stories that entertain and amuse, providing a lighthearted escape from everyday life.",984,Commerce,Medium,Yes
Develop page thing.,Geoffrey Colon,Smith Inc,2016-06-11,Non-Fiction,10,Available,Teens,978-1-4058-4357-7,Reference,1.9,48,Spanish,"A fascinating history of significant events and figures that shaped the world, providing readers with a deeper understanding of the past.",209,Commerce,Easy,Yes
Not mission they.,Megan Russo,Wilson-Malone,2018-08-12,Fiction,6,2024-07-03,Young Adults,978-0-7268-6729-3,Special Collection,4.3,45,Chinese,A motivational book that empowers readers to take control of their lives and pursue their passions with confidence.,611,Science,Hard,Yes
Watch live dinner.,Desiree Hernandez,Robertson LLC,2014-09-06,Mystery,2,Available,Adults,978-0-506-01234-9,Reserve,1.1,285,English,"A poetic exploration of life's beauty and struggles, using evocative language and imagery to convey deep emotions.",445,Art,Medium,Yes
Fly.,Michelle Johnson,"Lam, Yang and Burns",2016-10-20,Biography,2,Available,Adults,978-0-222-17032-3,Reference,3.4,886,Spanish,"A humorous collection of anecdotes and stories that entertain and amuse, providing a lighthearted escape from everyday life.",932,Science,Medium,No
Second present.,Tina Caldwell,"Hebert, Collins and Herrera",2015-03-13,Fiction,0,2024-06-29,Young Adults,978-1-05-266561-4,Reference,3.8,906,German,"A heartwarming romance that follows the blossoming love between two characters, overcoming obstacles and finding true happiness.",728,Commerce,Medium,Yes
Unit television involve.,Teresa Dorsey,"Roberts, Mccoy and Brown",2017-09-15,Children's,0,2024-07-11,Seniors,978-0-491-03718-1,General,1.9,365,Japanese,"An insightful exploration of human emotions and relationships, delving deep into the complexities of love, loss, and personal growth.",187,Art,Medium,Yes
Risk pass music.,Amy Kaiser,Daniels LLC,2022-10-03,Fantasy,5,Available,Children,978-0-05-521073-9,Special Collection,1.9,991,Japanese,"A poetic exploration of life's beauty and struggles, using evocative language and imagery to convey deep emotions.",924,Science,Medium,No
Situation left fire.,Jon Bowers,Leonard-Beasley,2018-09-06,Science Fiction,8,Available,Teens,978-0-307-17036-1,Reserve,4.2,894,Japanese,"A charming children's book that captivates young readers with its engaging story, colorful illustrations, and valuable life lessons.",338,Science,Medium,No
Learn sense account.,Chris Shaffer,Wagner and Sons,2018-04-25,Science Fiction,0,Available,Adults,978-1-73192-349-3,General,4.4,160,Chinese,A comprehensive self-help guide offering practical advice and strategies for personal development and achieving life goals.,783,Art,Medium,No
Huge out.,Tara Mann,"Barrett, Sutton and Moss",2018-04-12,Romance,0,Available,Teens,978-1-80917-272-3,Reference,2.7,638,Japanese,"A fascinating history of significant events and figures that shaped the world, providing readers with a deeper understanding of the past.",792,Science,Easy,No
Training few difficult.,Sandra Jones,"Suarez, Navarro and Campbell",2020-10-19,Non-Fiction,0,Available,Children,978-1-4787-5531-9,Reference,3.4,764,Japanese,"A thought-provoking biography of a remarkable individual, highlighting their achievements, struggles, and contributions to society.",401,Art,Hard,Yes
Within require standard identify.,Carrie Gregory,"Fernandez, Potter and Smith",2022-11-17,Romance,1,Available,Children,978-1-167-72022-2,Reference,3.0,596,Japanese,"An engaging analysis of contemporary social issues, encouraging readers to reflect on and challenge their perspectives.",264,Science,Easy,Yes
Such security.,Suzanne Ramirez,Collins PLC,2017-02-02,Biography,9,Available,Adults,978-1-144-86216-7,General,4.4,485,German,"A fascinating history of significant events and figures that shaped the world, providing readers with a deeper understanding of the past.",140,Commerce,Medium,Yes
